lex	beep	length	hce
ROOMING	r uw m ih ng	5	ɹ ʉː m ɪ ŋ
ROOST'S	r uw s t s	5	ɹ ʉː s t s
ROOSTER	r uw s t ax	5	ɹ ʉː s t ə
ROOSTS	r uw s t s	5	ɹ ʉː s t s
ROOTED	r uw t ih d	5	ɹ ʉː t ɪ d
ROOTER	r uw t ax r	5	ɹ ʉː t ə ɹ
ROOTERS	r uw t ax z	5	ɹ ʉː t ə z
ROOTING	r uw t ih ng	5	ɹ ʉː t ɪ ŋ
ROOTLED	r uw t l d	5	ɹ ʉː t l d
ROOTLES	r uw t l z	5	ɹ ʉː t l z
ROPER	r ow p ax r	5	ɹ əʉ p ə ɹ
ROPER'S	r ow p aa z	5	ɹ əʉ p ɐː z
ROPERS	r ow p ax z	5	ɹ əʉ p ə z
ROPEWAY	r ow p w ey	5	ɹ əʉ p w æɪ
ROPIER	r ow p ia r	5	ɹ əʉ p ɪə ɹ
ROPING	r ow p ih ng	5	ɹ əʉ p ɪ ŋ
ROQUEFORT	r oh k f ao	5	ɹ ɔ k f oː
ROQUEMORE	r oh k m ao	5	ɹ ɔ k m oː
ROQUER	r oh k ax r	5	ɹ ɔ k ə ɹ
ROQUETTE	r ow k eh t	5	ɹ əʉ k e t
ROSA'S	r ow z ax z	5	ɹ əʉ z ə z
ROSACE	r ow z ey s	5	ɹ əʉ z æɪ s
ROSAS	r ow z ax z	5	ɹ əʉ z ə z
ROSE'S	r ow z ih z	5	ɹ əʉ z ɪ z
ROSEANNE	r ow z ae n	5	ɹ əʉ z æ n
ROSEATE	r ow z ia t	5	ɹ əʉ z ɪə t
ROSEBAY	r ow z b ey	5	ɹ əʉ z b æɪ
ROSENOW	r ow z n aw	5	ɹ əʉ z n æɔ
ROSER	r ow z ax r	5	ɹ əʉ z ə ɹ
ROSES	r ow z ih z	5	ɹ əʉ z ɪ z
ROSETTE	r ow z eh t	5	ɹ əʉ z e t
ROSIE'S	r ow z iy z	5	ɹ əʉ z iː z
ROSIED	r ow z iy d	5	ɹ əʉ z iː d
ROSIER	r ow z ia r	5	ɹ əʉ z ɪə ɹ
ROSIER'S	r ow z ia z	5	ɹ əʉ z ɪə z
ROSIERS	r ow z ia z	5	ɹ əʉ z ɪə z
ROSIES	r ow z iy z	5	ɹ əʉ z iː z
ROSIN	r oh z ih n	5	ɹ ɔ z ɪ n
ROSS'S	r oh s ih z	5	ɹ ɔ s ɪ z
ROSSAL	r oh s ax l	5	ɹ ɔ s ə l
ROSSAN	r oh s ax n	5	ɹ ɔ s ə n
ROSSE'S	r oh s ih z	5	ɹ ɔ s ɪ z
ROSSELL	r oh s eh l	5	ɹ ɔ s e l
ROSSEN	r oh s eh n	5	ɹ ɔ s e n
ROSSER'S	r oh s ax z	5	ɹ ɔ s ə z
ROSSES	r oh s ih z	5	ɹ ɔ s ɪ z
ROSSING	r oh s ih ng	5	ɹ ɔ s ɪ ŋ
ROSSIP	r oh s ih p	5	ɹ ɔ s ɪ p
ROSSIS	r oh s ih s	5	ɹ ɔ s ɪ s
ROSSLARE	r oh s l ea	5	ɹ ɔ s l eː
ROSSLEY	r oh s l iy	5	ɹ ɔ s l iː
ROSTAL	r oh s t l	5	ɹ ɔ s t l
ROSTEL	r oh s t l	5	ɹ ɔ s t l
ROSTER	r oh s t ax	5	ɹ ɔ s t ə
ROSTIA	r oh s t ia	5	ɹ ɔ s t ɪə
ROSTY	r oh s t iy	5	ɹ ɔ s t iː
ROSY'S	r ow z iy z	5	ɹ əʉ z iː z
ROTA'S	r ow t ax z	5	ɹ əʉ t ə z
ROTAED	r ow t ax d	5	ɹ əʉ t ə d
ROTAS	r ow t ax z	5	ɹ əʉ t ə z
ROTATE	r ow t ey t	5	ɹ əʉ t æɪ t
ROTECH	r ow t eh k	5	ɹ əʉ t e k
ROTELL	r oh t eh l	5	ɹ ɔ t e l
ROTELLE	r oh t eh l	5	ɹ ɔ t e l
ROTHER	r oh t hh er	5	ɹ ɔ t h ɜː
ROTHES	r oh th ih s	5	ɹ ɔ θ ɪ s
ROTHESAY	r oh th s iy	5	ɹ ɔ θ s iː
ROTO'S	r oh t ow z	5	ɹ ɔ t əʉ z
ROTOR	r ow t ax r	5	ɹ əʉ t ə ɹ
ROTOR'S	r ow t ax z	5	ɹ əʉ t ə z
ROTORS	r ow t ax z	5	ɹ əʉ t ə z
ROTTED	r oh t ih d	5	ɹ ɔ t ɪ d
ROTTEN'S	r oh t n z	5	ɹ ɔ t n z
ROTTENER	r oh t n ax	5	ɹ ɔ t n ə
ROTTER	r oh t ax r	5	ɹ ɔ t ə ɹ
ROTTERD	r oh t ax d	5	ɹ ɔ t ə d
ROTTERS	r oh t ax z	5	ɹ ɔ t ə z
ROTTIES	r oh t ih z	5	ɹ ɔ t ɪ z
ROTTING	r oh t ih ng	5	ɹ ɔ t ɪ ŋ
ROTTLER	r oh t l ax	5	ɹ ɔ t l ə
ROUBLE'S	r uw b l z	5	ɹ ʉː b l z
ROUBLED	r uw b l d	5	ɹ ʉː b l d
ROUBLES	r uw b l z	5	ɹ ʉː b l z
ROUEN'S	r uw oh ng z	5	ɹ ʉː ɔ ŋ z
ROUENS	r uw oh ng z	5	ɹ ʉː ɔ ŋ z
ROUGE'S	r uw zh ih z	5	ɹ ʉː ʒ ɪ z
ROUGES	r uw zh ih z	5	ɹ ʉː ʒ ɪ z
ROUGHAGE	r ah f ih jh	5	ɹ ɐ f ɪ dʒ
ROUGHENED	r ah f n d	5	ɹ ɐ f n d
ROUGHENS	r ah f n z	5	ɹ ɐ f n z
ROUGHER	r ah f ax r	5	ɹ ɐ f ə ɹ
ROUGHERS	r ah f ax z	5	ɹ ɐ f ə z
ROUGHIES	r ah f ih z	5	ɹ ɐ f ɪ z
ROUGHING	r ah f ih ng	5	ɹ ɐ f ɪ ŋ
ROUGHISH	r ah f ih sh	5	ɹ ɐ f ɪ ʃ
ROUGHLY	r ah f l iy	5	ɹ ɐ f l iː
ROUGING	r uw zh ih ng	5	ɹ ʉː ʒ ɪ ŋ
ROULADE	r uw l aa d	5	ɹ ʉː l ɐː d
ROULERS	r uw l ax z	5	ɹ ʉː l ə z
ROULET	r uw l eh t	5	ɹ ʉː l e t
ROULETTE	r uw l eh t	5	ɹ ʉː l e t
ROUNCY	r aw n s iy	5	ɹ æɔ n s iː
ROUND'S	r aw n d z	5	ɹ æɔ n d z
ROUNDA	r aw n d ax	5	ɹ æɔ n d ə
ROUNDEL	r aw n d l	5	ɹ æɔ n d l
ROUNDER	r aw n d ax	5	ɹ æɔ n d ə
ROUNDS	r aw n d z	5	ɹ æɔ n d z
ROUSE'S	r aw z ih z	5	ɹ æɔ z ɪ z
ROUSER	r aw z ax r	5	ɹ æɔ z ə ɹ
ROUSERS	r aw z ax z	5	ɹ æɔ z ə z
ROUSES	r aw z ih z	5	ɹ æɔ z ɪ z
ROUSING	r aw z ih ng	5	ɹ æɔ z ɪ ŋ
ROUTED	r aw t ih d	5	ɹ æɔ t ɪ d
ROUTED	r uw t ih d	5	ɹ ʉː t ɪ d
ROUTEING	r uw t ih ng	5	ɹ ʉː t ɪ ŋ
ROUTER	r aw t ax r	5	ɹ æɔ t ə ɹ
ROUTER	r uw t ax r	5	ɹ ʉː t ə ɹ
ROUTERS	r aw t ax z	5	ɹ æɔ t ə z
ROUTERS	r uw t ax z	5	ɹ ʉː t ə z
ROUTEWAY	r uw t w ey	5	ɹ ʉː t w æɪ
ROUTINE	r uw t iy n	5	ɹ ʉː t iː n
ROUTING	r aw t ih ng	5	ɹ æɔ t ɪ ŋ
ROUTING	r uw t ih ng	5	ɹ ʉː t ɪ ŋ
ROUTIS	r uw t iy z	5	ɹ ʉː t iː z
ROUTLEY	r aw t l ey	5	ɹ æɔ t l æɪ
ROUTLY	r aw t l iy	5	ɹ æɔ t l iː
ROVER	r ow v ax r	5	ɹ əʉ v ə ɹ
ROVER'S	r ow v ax z	5	ɹ əʉ v ə z
ROVERED	r ow v ax d	5	ɹ əʉ v ə d
ROVERES	r ow v ax z	5	ɹ əʉ v ə z
ROVERS	r ow v ax z	5	ɹ əʉ v ə z
ROVERT	r ow v er t	5	ɹ əʉ v ɜː t
ROVINE	r ow v ay n	5	ɹ əʉ v ɑe n
ROVING	r ow v ih ng	5	ɹ əʉ v ɪ ŋ
ROW-BOAT	r ow b ow t	5	ɹ əʉ b əʉ t
ROWABLE	r aw ey b l	5	ɹ æɔ æɪ b l
ROWAN'S	r ow ax n z	5	ɹ əʉ ə n z
ROWAND	r ow ax n d	5	ɹ əʉ ə n d
ROWANS	r ow ax n z	5	ɹ əʉ ə n z
ROWBACK	r ow b ae k	5	ɹ əʉ b æ k
ROWBOAT	r ow b ow t	5	ɹ əʉ b əʉ t
ROWDED	r aw d ih d	5	ɹ æɔ d ɪ d
ROWDEN	r aw d eh n	5	ɹ æɔ d e n
ROWDIER	r aw d ia r	5	ɹ æɔ d ɪə ɹ
ROWDIES	r aw d ih z	5	ɹ æɔ d ɪ z
ROWELED	r aw ax l d	5	ɹ æɔ ə l d
ROWELLED	r aw ax l d	5	ɹ æɔ ə l d
ROWELLS	r aw eh l z	5	ɹ æɔ e l z
ROWELS	r aw ax l z	5	ɹ æɔ ə l z
ROWER'S	r ow ax r z	5	ɹ əʉ ə ɹ z
ROWING'S	r aw ih ng z	5	ɹ æɔ ɪ ŋ z
ROWING'S	r ow ih ng z	5	ɹ əʉ ɪ ŋ z
ROWINGS	r aw ih ng z	5	ɹ æɔ ɪ ŋ z
ROWINGS	r ow ih ng z	5	ɹ əʉ ɪ ŋ z
ROWLAN	r ow l ax n	5	ɹ əʉ l ə n
ROWLES	r aw l eh z	5	ɹ æɔ l e z
ROWLET	r aw l eh t	5	ɹ æɔ l e t
ROWLEY'S	r aw l ey z	5	ɹ æɔ l æɪ z
ROWLEYS	r aw l ey z	5	ɹ æɔ l æɪ z
ROWLOCK	r oh l ax k	5	ɹ ɔ l ə k
ROWN'S	r aw eh n z	5	ɹ æɔ e n z
ROWNED	r aw n eh d	5	ɹ æɔ n e d
ROWSE'S	r aw z iy z	5	ɹ æɔ z iː z
ROWSER	r aw z ax r	5	ɹ æɔ z ə ɹ
ROWSER	r ow z ax r	5	ɹ əʉ z ə ɹ
ROWSON	r aw s ah n	5	ɹ æɔ s ɐ n
ROWTON	r aw t ah n	5	ɹ æɔ t ɐ n
ROYAL'S	r oy ax l z	5	ɹ oɪ ə l z
ROYALES	r oy ax l z	5	ɹ oɪ ə l z
ROYALLY	r oy ax l iy	5	ɹ oɪ ə l iː
ROYALS	r oy ax l z	5	ɹ oɪ ə l z
ROYD'S	r oy d iy z	5	ɹ oɪ d iː z
ROYDEN	r oy d eh n	5	ɹ oɪ d e n
ROYDON	r oy d oh n	5	ɹ oɪ d ɔ n
ROYER'S	r oy ax r z	5	ɹ oɪ ə ɹ z
ROYERS	r oy ax r z	5	ɹ oɪ ə ɹ z
ROYSTER	r oy s t ax	5	ɹ oɪ s t ə
RUB-UP	r ah b ah p	5	ɹ ɐ b ɐ p
RUBACK	r ah b ae k	5	ɹ ɐ b æ k
RUBALE	r ah b ey l	5	ɹ ɐ b æɪ l
RUBALL	r ah b ao l	5	ɹ ɐ b oː l
RUBARE	r ah b aa r	5	ɹ ɐ b ɐː ɹ
RUBBER	r ah b ax r	5	ɹ ɐ b ə ɹ
RUBBER'S	r ah b ax z	5	ɹ ɐ b ə z
RUBBERED	r ah b ax d	5	ɹ ɐ b ə d
RUBBERER	r ah b ax ax	5	ɹ ɐ b ə ə
RUBBERS	r ah b ax z	5	ɹ ɐ b ə z
RUBBIES	r ah b ih z	5	ɹ ɐ b ɪ z
RUBBING	r ah b ih ng	5	ɹ ɐ b ɪ ŋ
RUBBISH	r ah b ih sh	5	ɹ ɐ b ɪ ʃ
RUBBLE'S	r ah b l z	5	ɹ ɐ b l z
RUBBLED	r ah b l d	5	ɹ ɐ b l d
RUBBLER	r ah b l ax	5	ɹ ɐ b l ə
RUBBLES	r ah b l z	5	ɹ ɐ b l z
RUBBLIER	r ah b l ia	5	ɹ ɐ b l ɪə
RUBBLY	r ah b l iy	5	ɹ ɐ b l iː
RUBEL	r ah b eh l	5	ɹ ɐ b e l
RUBELL	r ah b eh l	5	ɹ ɐ b e l
RUBELLE	r ah b eh l	5	ɹ ɐ b e l
RUBEN	r ah b eh n	5	ɹ ɐ b e n
RUBERG	r ah b er g	5	ɹ ɐ b ɜː g
RUBI'S	r ah b ay z	5	ɹ ɐ b ɑe z
RUBIES	r uw b ih z	5	ɹ ʉː b ɪ z
RUBIN	r ah b ih n	5	ɹ ɐ b ɪ n
RUBLEY	r ah b l ey	5	ɹ ɐ b l æɪ
RUBOUT	r ah b aw t	5	ɹ ɐ b æɔ t
RUBY'S	r uw b iy z	5	ɹ ʉː b iː z
RUCKER	r ah k ax r	5	ɹ ɐ k ə ɹ
RUCKER'S	r ah k ax z	5	ɹ ɐ k ə z
RUCKERS	r ah k ax z	5	ɹ ɐ k ə z
RUCKING	r ah k ih ng	5	ɹ ɐ k ɪ ŋ
RUCKUS	r ah k ax s	5	ɹ ɐ k ə s
RUDDELL	r ah d eh l	5	ɹ ɐ d e l
RUDDER	r ah d ax r	5	ɹ ɐ d ə ɹ
RUDDER'S	r ah d ax z	5	ɹ ɐ d ə z
RUDDERS	r ah d ax z	5	ɹ ɐ d ə z
RUDDIER	r ah d ia r	5	ɹ ɐ d ɪə ɹ
RUDDING	r ah d ih ng	5	ɹ ɐ d ɪ ŋ
RUDDLE'S	r ah d l z	5	ɹ ɐ d l z
RUDDLED	r ah d l d	5	ɹ ɐ d l d
RUDDLES	r ah d l z	5	ɹ ɐ d l z
RUDDY'S	r ah d iy z	5	ɹ ɐ d iː z
RUDELEY	r uw d l ey	5	ɹ ʉː d l æɪ
RUDELS	r uw d l z	5	ɹ ʉː d l z
RUDELY	r uw d l iy	5	ɹ ʉː d l iː
RUDEN	r uw d eh n	5	ɹ ʉː d e n
RUDER	r uw d ax r	5	ɹ ʉː d ə ɹ
RUDER'S	r uw d ax z	5	ɹ ʉː d ə z
RUDERS	r uw d ax z	5	ɹ ʉː d ə z
RUDESS	r uw d ih s	5	ɹ ʉː d ɪ s
RUDICK	r uw d ih k	5	ɹ ʉː d ɪ k
RUDIE	r uw d ay iy	5	ɹ ʉː d ɑe iː
RUDING	r uw d ih ng	5	ɹ ʉː d ɪ ŋ
RUDISH	r uw d ih sh	5	ɹ ʉː d ɪ ʃ
RUDY'S	r uw d iy z	5	ɹ ʉː d iː z
RUEBEL	r uw b eh l	5	ɹ ʉː b e l
RUEFUL	r uw f ax l	5	ɹ ʉː f ə l
RUEL'S	r uw eh l z	5	ɹ ʉː e l z
RUELAS	r uw l ae s	5	ɹ ʉː l æ s
RUELES	r uw l eh z	5	ɹ ʉː l e z
RUESING	r uw z ih ng	5	ɹ ʉː z ɪ ŋ
RUESOME	r uw s ah m	5	ɹ ʉː s ɐ m
RUFFER	r ah f ax r	5	ɹ ɐ f ə ɹ
RUFFIAN	r ah f ia n	5	ɹ ɐ f ɪə n
RUFFIN	r ah f ih n	5	ɹ ɐ f ɪ n
RUFFING	r ah f ih ng	5	ɹ ɐ f ɪ ŋ
RUFFLE'S	r ah f l z	5	ɹ ɐ f l z
RUFFLED	r ah f l d	5	ɹ ɐ f l d
RUFFLER	r ah f l ax	5	ɹ ɐ f l ə
RUFFLES	r ah f l z	5	ɹ ɐ f l z
RUFFLY	r ah f l iy	5	ɹ ɐ f l iː
RUFFO'S	r ah f ow z	5	ɹ ɐ f əʉ z
RUGBY	r ah g b iy	5	ɹ ɐ g b iː
RUGELEY	r uw jh l iy	5	ɹ ʉː dʒ l iː
RUGELY	r uw jh l iy	5	ɹ ʉː dʒ l iː
RUGER	r ah g ax r	5	ɹ ɐ g ə ɹ
RUGER'S	r ah g ax z	5	ɹ ɐ g ə z
RUGERS	r ah g ax z	5	ɹ ɐ g ə z
RUGGED	r ah g ih d	5	ɹ ɐ g ɪ d
RUGGER	r ah g ax r	5	ɹ ɐ g ə ɹ
RUGGERED	r ah g ax d	5	ɹ ɐ g ə d
RUGGERS	r ah g ax z	5	ɹ ɐ g ə z
RUGGING	r ah g ih ng	5	ɹ ɐ g ɪ ŋ
RUGGISH	r ah g ih sh	5	ɹ ɐ g ɪ ʃ
RUGGLES	r ah g l z	5	ɹ ɐ g l z
RUGGLES'	r ah g l z	5	ɹ ɐ g l z
RUIN'S	r uw ih n z	5	ɹ ʉː ɪ n z
RUINED	r uw ih n d	5	ɹ ʉː ɪ n d
RUINER	r uw ih n ax	5	ɹ ʉː ɪ n ə
RUINS	r uw ih n z	5	ɹ ʉː ɪ n z
RULER	r uw l ax r	5	ɹ ʉː l ə ɹ
RULER'S	r uw l ax z	5	ɹ ʉː l ə z
RULERS	r uw l ax z	5	ɹ ʉː l ə z
RULING	r uw l ih ng	5	ɹ ʉː l ɪ ŋ
RUMACK	r ah m ae k	5	ɹ ɐ m æ k
RUMAGE	r ah m ey jh	5	ɹ ɐ m æɪ dʒ
RUMANN	r ah m ae n	5	ɹ ɐ m æ n
RUMBA	r ah m b ax	5	ɹ ɐ m b ə
RUMBIA	r ah m b ia	5	ɹ ɐ m b ɪə
RUMBLE	r ah m b l	5	ɹ ɐ m b l
RUMBLEY	r ah m l ey	5	ɹ ɐ m l æɪ
RUMER	r ah m ax r	5	ɹ ɐ m ə ɹ
RUMI'S	r ah m ay z	5	ɹ ɐ m ɑe z
RUMLEY	r ah m l ey	5	ɹ ɐ m l æɪ
RUMMAGE	r ah m ih jh	5	ɹ ɐ m ɪ dʒ
RUMMEL	r ah m ax l	5	ɹ ɐ m ə l
RUMMER	r ah m ax r	5	ɹ ɐ m ə ɹ
RUMMERS	r ah m ax z	5	ɹ ɐ m ə z
RUMMIES	r ah m ih z	5	ɹ ɐ m ɪ z
RUMORED	r ah m ao d	5	ɹ ɐ m oː d
RUMORER	r ah m ao ax	5	ɹ ɐ m oː ə
RUMORES	r ah m ao z	5	ɹ ɐ m oː z
RUMOUR	r uw m ax r	5	ɹ ʉː m ə ɹ
RUMOUR'S	r uw m ax z	5	ɹ ʉː m ə z
RUMOURED	r uw m ax d	5	ɹ ʉː m ə d
RUMOURS	r uw m ax z	5	ɹ ʉː m ə z
RUMP'S	r ah m p s	5	ɹ ɐ m p s
RUMPED	r ah m p t	5	ɹ ɐ m p t
RUMPER	r ah m p ax	5	ɹ ɐ m p ə
RUMPH	r ah m p f	5	ɹ ɐ m p f
RUMPIER	r ah m p ia	5	ɹ ɐ m p ɪə
RUMPLE	r ah m p l	5	ɹ ɐ m p l
RUMPS	r ah m p s	5	ɹ ɐ m p s
RUN-OFF	r ah n oh f	5	ɹ ɐ n ɔ f
RUN-UP	r ah n ah p	5	ɹ ɐ n ɐ p
RUNCO	r ah ng k ow	5	ɹ ɐ ŋ k əʉ
RUNDEL	r ah n d l	5	ɹ ɐ n d l
RUNDLE	r ah n d l	5	ɹ ɐ n d l
RUNGE'S	r ah ng iy z	5	ɹ ɐ ŋ iː z
RUNGER	r ah ng ax r	5	ɹ ɐ ŋ ə ɹ
RUNIC	r uw n ih k	5	ɹ ʉː n ɪ k
RUNICE	r uw n ih s	5	ɹ ʉː n ɪ s
RUNICH	r uw n ih k	5	ɹ ʉː n ɪ k
RUNING	r ah n ih ng	5	ɹ ɐ n ɪ ŋ
RUNNELLED	r ah n l d	5	ɹ ɐ n l d
RUNNELS	r ah n l z	5	ɹ ɐ n l z
RUNNER	r ah n ax r	5	ɹ ɐ n ə ɹ
RUNNER'S	r ah n ax z	5	ɹ ɐ n ə z
RUNNERED	r ah n ax d	5	ɹ ɐ n ə d
RUNNERS	r ah n ax z	5	ɹ ɐ n ə z
RUNNIER	r ah n ia r	5	ɹ ɐ n ɪə ɹ
RUNNIN	r ah n ih n	5	ɹ ɐ n ɪ n
RUNNIN'	r ah n ih n	5	ɹ ɐ n ɪ n
RUNNING	r ah n ih ng	5	ɹ ɐ n ɪ ŋ
RUNOFF	r ah n ao f	5	ɹ ɐ n oː f
RUNOUT	r ah n aw t	5	ɹ ɐ n æɔ t
RUNT'S	r ah n t s	5	ɹ ɐ n t s
RUNTAL	r ah n t l	5	ɹ ɐ n t l
RUNTE	r ah n t iy	5	ɹ ɐ n t iː
RUNTIER	r ah n t ia	5	ɹ ɐ n t ɪə
RUNTS	r ah n t s	5	ɹ ɐ n t s
RUNWAY	r ah n w ey	5	ɹ ɐ n w æɪ
RUPEE'S	r uw p iy z	5	ɹ ʉː p iː z
RUPEES	r uw p iy z	5	ɹ ʉː p iː z
RUPERT	r uw p ax t	5	ɹ ʉː p ə t
RUPIAH	r uw p iy ax	5	ɹ ʉː p iː ə
RUPTION	r ah p sh n	5	ɹ ɐ p ʃ n
RUPTURE	r ah p ch ax	5	ɹ ɐ p tʃ ə
RURAL	r ua r ax l	5	ɹ ʊə ɹ ə l
RURICK	r ua r ih k	5	ɹ ʊə ɹ ɪ k
RUSE'S	r uw z ey z	5	ɹ ʉː z æɪ z
RUSE'S	r uw z ih z	5	ɹ ʉː z ɪ z
RUSES	r uw z ih z	5	ɹ ʉː z ɪ z
RUSH'S	r ah sh ih z	5	ɹ ɐ ʃ ɪ z
RUSHER'S	r ah sh ax z	5	ɹ ɐ ʃ ə z
RUSHERS	r ah sh ax z	5	ɹ ɐ ʃ ə z
RUSHES	r ah sh ih z	5	ɹ ɐ ʃ ɪ z
RUSHIER	r ah sh ia r	5	ɹ ɐ ʃ ɪə ɹ
RUSHING	r ah sh ih ng	5	ɹ ɐ ʃ ɪ ŋ
RUSHLOW	r ah sh l ow	5	ɹ ɐ ʃ l əʉ
RUSING	r uw z ih ng	5	ɹ ʉː z ɪ ŋ
RUSK'S	r ah s k s	5	ɹ ɐ s k s
RUSKED	r ah s k t	5	ɹ ɐ s k t
RUSKER	r ah s k ax	5	ɹ ɐ s k ə
RUSKEY	r ah s k iy	5	ɹ ɐ s k iː
RUSKS	r ah s k s	5	ɹ ɐ s k s
RUSS'S	r ah s ih z	5	ɹ ɐ s ɪ z
RUSSEL'S	r ah s l z	5	ɹ ɐ s l z
RUSSELL	r ah s eh l	5	ɹ ɐ s e l
RUSSELS	r ah s l z	5	ɹ ɐ s l z
RUSSES	r ah s ih z	5	ɹ ɐ s ɪ z
RUSSET	r ah s ih t	5	ɹ ɐ s ɪ t
RUSSETT	r ah s ih t	5	ɹ ɐ s ɪ t
RUSSIA'S	r ah sh ax z	5	ɹ ɐ ʃ ə z
RUSSIAN	r ah sh ax n	5	ɹ ɐ ʃ ə n
RUSSIAS	r ah sh ax z	5	ɹ ɐ ʃ ə z
RUST'S	r ah s t s	5	ɹ ɐ s t s
RUSTEE	r ah s t iy	5	ɹ ɐ s t iː
RUSTIER	r ah s t ia	5	ɹ ɐ s t ɪə
RUSTLED	r ah s l d	5	ɹ ɐ s l d
RUSTLER	r ah s l ax	5	ɹ ɐ s l ə
RUSTLES	r ah s l z	5	ɹ ɐ s l z
RUSTOW	r ah s t ow	5	ɹ ɐ s t əʉ
RUSTS	r ah s t s	5	ɹ ɐ s t s
RUSTY	r ah s t iy	5	ɹ ɐ s t iː
RUTA'S	r ah t ey z	5	ɹ ɐ t æɪ z
RUTATE	r ah t eh t	5	ɹ ɐ t e t
RUTER	r ah t ax r	5	ɹ ɐ t ə ɹ
RUTHANN	r uw th ae n	5	ɹ ʉː θ æ n
RUTHENE	r uw th iy n	5	ɹ ʉː θ iː n
RUTHER	r uw th ax r	5	ɹ ʉː θ ə ɹ
RUTHING	r uw th ih ng	5	ɹ ʉː θ ɪ ŋ
RUTLEIGH	r ah t l iy	5	ɹ ɐ t l iː
RUTLEY	r ah t l ey	5	ɹ ɐ t l æɪ
RUTTED	r ah t ih d	5	ɹ ɐ t ɪ d
RUTTER	r ah t t er	5	ɹ ɐ t t ɜː
RUTTIER	r ah t t ia	5	ɹ ɐ t t ɪə
RUTTING	r ah t ih ng	5	ɹ ɐ t ɪ ŋ
RUTTISH	r ah t ih sh	5	ɹ ɐ t ɪ ʃ
RYDELL	r ay d eh l	5	ɹ ɑe d e l
RYDEN	r ay d eh n	5	ɹ ɑe d e n
RYDER	r ay d ax r	5	ɹ ɑe d ə ɹ
RYDER'S	r ay d aa z	5	ɹ ɑe d ɐː z
RYDERS	r ay d ax z	5	ɹ ɑe d ə z
RYEHILL	r ay hh ih l	5	ɹ ɑe h ɪ l
R\'EGIME	r ey zh iy m	5	ɹ æɪ ʒ iː m
S._A._S.	eh s ay eh s	5	e s ɑe e s
S._F._O.	eh s eh f ow	5	e s e f əʉ
S._O._S.	eh s ow eh s	5	e s əʉ e s
SABAH'S	s ah b ax z	5	s ɐ b ə z
SABAHS	s ah b ax z	5	s ɐ b ə z
SABBATH	s ae b ax th	5	s æ b ə θ
SABINE	s ae b ay n	5	s æ b ɑe n
SABLE'S	s ey b l z	5	s æɪ b l z
SABLER	s ey b l ax	5	s æɪ b l ə
SABLES	s ey b l z	5	s æɪ b l z
SABO'S	s ae b ow z	5	s æ b əʉ z
SABOTED	s ae b ow d	5	s æ b əʉ d
SABOTS	s ae b ow z	5	s æ b əʉ z
SABRE	s ey b ax r	5	s æɪ b ə ɹ
SABRE'S	s ey b ax z	5	s æɪ b ə z
SABRED	s ey b ax d	5	s æɪ b ə d
SABRES	s ey b ax z	5	s æɪ b ə z
SACCADE	s ae k aa d	5	s æ k ɐː d
SACHEM	s ey ch ax m	5	s æɪ tʃ ə m
SACHER	s ae k hh er	5	s æ k h ɜː
SACHETED	s ae sh ey d	5	s æ ʃ æɪ d
SACHETS	s ae sh ey z	5	s æ ʃ æɪ z
SACKAGE	s ae k ey jh	5	s æ k æɪ dʒ
SACKERS	s ae k ax z	5	s æ k ə z
SACKING	s ae k ih ng	5	s æ k ɪ ŋ
SACKLEY	s ae k l ey	5	s æ k l æɪ
SACO'S	s ae k ow z	5	s æ k əʉ z
SACRA	s ey k r ax	5	s æɪ k ɹ ə
SADA'S	s ae d ey z	5	s æ d æɪ z
SADDENED	s ae d n d	5	s æ d n d
SADDENS	s ae d n z	5	s æ d n z
SADDER	s ae d ax r	5	s æ d ə ɹ
SADDLE'S	s ae d l z	5	s æ d l z
SADDLED	s ae d l d	5	s æ d l d
SADDLER	s ae d l ax	5	s æ d l ə
SADDLES	s ae d l z	5	s æ d l z
SADER	s ae d ax r	5	s æ d ə ɹ
SADER'S	s ae d ax z	5	s æ d ə z
SADERS	s ae d ax z	5	s æ d ə z
SADHUS	s aa d uw z	5	s ɐː d ʉː z
SADIES	s ey d ih z	5	s æɪ d ɪ z
SADLEE	s ae d l iy	5	s æ d l iː
SADLY	s ae d l iy	5	s æ d l iː
SADOFF	s ae d ao f	5	s æ d oː f
SAFELY	s ey f l iy	5	s æɪ f l iː
SAFENER	s ey f n ax	5	s æɪ f n ə
SAFER	s ey f ax r	5	s æɪ f ə ɹ
SAFER'S	s ey f ax z	5	s æɪ f ə z
SAFERS	s ey f ax z	5	s æɪ f ə z
SAFETY	s ey f t iy	5	s æɪ f t iː
SAFEWAY	s ey f w ey	5	s æɪ f w æɪ
SAFFREY	s ae f r iy	5	s æ f ɹ iː
SAGA'S	s aa g ax z	5	s ɐː g ə z
SAGAR	s aa g ax ax	5	s ɐː g ə ə
SAGAS	s aa g ax z	5	s ɐː g ə z
SAGE'S	s ey jh ih z	5	s æɪ dʒ ɪ z
SAGELY	s ey jh l iy	5	s æɪ dʒ l iː
SAGER	s ae g ax r	5	s æ g ə ɹ
SAGER	s ey jh ax r	5	s æɪ dʒ ə ɹ
SAGER'S	s ey jh aa z	5	s æɪ dʒ ɐː z
SAGERS	s ae g ax z	5	s æ g ə z
SAGERS	s ey jh ax z	5	s æɪ dʒ ə z
SAGES	s ey jh ih z	5	s æɪ dʒ ɪ z
SAGGING	s ae g ih ng	5	s æ g ɪ ŋ
SAGING	s ae g ih ng	5	s æ g ɪ ŋ
SAGOS	s ey g ow z	5	s æɪ g əʉ z
SAIGON	s ay g oh n	5	s ɑe g ɔ n
SAILERS	s ey l ax z	5	s æɪ l ə z
SAILING	s ey l ih ng	5	s æɪ l ɪ ŋ
SAILOR	s ey l ax r	5	s æɪ l ə ɹ
SAILOR'S	s ey l ax z	5	s æɪ l ə z
SAILORS	s ey l ax z	5	s æɪ l ə z
SAINT'S	s ey n t s	5	s æɪ n t s
SAINTES	s ey n t s	5	s æɪ n t s
SAINTS	s ey n t s	5	s æɪ n t s
SAINTS'	s ey n t s	5	s æɪ n t s
SAINTY	s ey n t iy	5	s æɪ n t iː
SAKA'S	s aa k ax z	5	s ɐː k ə z
SAKE'S	s aa k iy z	5	s ɐː k iː z
SAKER	s aa k iy ax	5	s ɐː k iː ə
SAKER	s ey k ax r	5	s æɪ k ə ɹ
SAKERS	s ey k ax z	5	s æɪ k ə z
SALA'S	s ae l ey z	5	s æ l æɪ z
SALAAM	s ax l aa m	5	s ə l ɐː m
SALAD	s ae l ax d	5	s æ l ə d
SALAM	s ae l ae m	5	s æ l æ m
SALAND	s ae l ax n	5	s æ l ə n
SALAVE	s ae l ae v	5	s æ l æ v
SALEEL	s ae l iy l	5	s æ l iː l
SALIC	s ae l ih k	5	s æ l ɪ k
SALICE	s ae l ay s	5	s æ l ɑe s
SALICK	s ae l ih k	5	s æ l ɪ k
SALIEN	s ey l ia n	5	s æɪ l ɪə n
SALINE	s ey l ay n	5	s æɪ l ɑe n
SALING	s ae l ih ng	5	s æ l ɪ ŋ
SALLEE	s ae l l iy	5	s æ l l iː
SALLET	s ae l ih t	5	s æ l ɪ t
SALLETT	s ae l ih t	5	s æ l ɪ t
SALLEY	s ae l l ey	5	s æ l l æɪ
SALLID	s ae l ih d	5	s æ l ɪ d
SALLIE	s ae l l ay	5	s æ l l ɑe
SALLIED	s ae l ih d	5	s æ l ɪ d
SALLIES	s ae l ih z	5	s æ l ɪ z
SALLIS	s ae l ih s	5	s æ l ɪ s
SALLOWED	s ae l ow d	5	s æ l əʉ d
SALLOWER	s ae l ow ax	5	s æ l əʉ ə
SALLOWS	s ae l ow z	5	s æ l əʉ z
SALLOWY	s ae l ow iy	5	s æ l əʉ iː
SALLY'S	s ae l iy z	5	s æ l iː z
SALLYS	s ae l iy z	5	s æ l iː z
SALMAR	s ae l m ax	5	s æ l m ə
SALMI	s ae l m iy	5	s æ l m iː
SALMIA	s ae l m ia	5	s æ l m ɪə
SALMON	s ae m ax n	5	s æ m ə n
SALO'S	s ae l ow z	5	s æ l əʉ z
SALON	s ae l oh n	5	s æ l ɔ n
SALOON	s ax l uw n	5	s ə l ʉː n
SALOPE	s ax l ow p	5	s ə l əʉ p
SALT'S	s ao l t s	5	s oː l t s
SALT'S	s oh l t s	5	s ɔ l t s
SALTER	s ao l t ax	5	s oː l t ə
SALTES	s ao l t s	5	s oː l t s
SALTES	s oh l t s	5	s ɔ l t s
SALTIER	s ao l t ia	5	s oː l t ɪə
SALTS	s ao l t s	5	s oː l t s
SALTY	s ao l t iy	5	s oː l t iː
SALTZ	s ao l t s	5	s oː l t s
SALUTE	s ax l uw t	5	s ə l ʉː t
SALVA	s ae l v ax	5	s æ l v ə
SALVE'S	s ae l v z	5	s æ l v z
SALVED	s ae l v d	5	s æ l v d
SALVER	s ae l v ax	5	s æ l v ə
SALVES	s ae l v z	5	s æ l v z
SALVIA	s ae l v ia	5	s æ l v ɪə
SALVO	s ae l v ow	5	s æ l v əʉ
SALWAY	s ae l w ey	5	s æ l w æɪ
SAMA'S	s ae m ey z	5	s æ m æɪ z
SAMARES	s ae m aa z	5	s æ m ɐː z
SAMBA	s ae m b ax	5	s æ m b ə
SAMBER	s ae m b ax	5	s æ m b ə
SAMBO	s ae m b ow	5	s æ m b əʉ
SAMBOL	s ae m b l	5	s æ m b l
SAMBOUR	s ae m b ua	5	s æ m b ʊə
SAMI'S	s ae m ay z	5	s æ m ɑe z
SAMIR	s ae m ia r	5	s æ m ɪə ɹ
SAMITE	s ae m ay t	5	s æ m ɑe t
SAMMY'S	s ae m iy z	5	s æ m iː z
SAMMYS	s ae m iy z	5	s æ m iː z
SAMOA	s ax m ow ax	5	s ə m əʉ ə
SAMOS	s ax m ow z	5	s ə m əʉ z
SAMPA	s ae m p ax	5	s æ m p ə
SAMPAS	s ae m p aa	5	s æ m p ɐː
SAMPIE	s ae m p ay	5	s æ m p ɑe
SAMPIER	s ae m p ia	5	s æ m p ɪə
SAMPLE	s aa m p l	5	s ɐː m p l
SAND'S	s ae n d z	5	s æ n d z
SANDA	s ae n d ax	5	s æ n d ə
SANDAL	s ae n d l	5	s æ n d l
SANDAU	s ae n d ao	5	s æ n d oː
SANDAY	s ae n d ey	5	s æ n d æɪ
SANDBY	s ae n b ay	5	s æ n b ɑe
SANDEE	s ae n d iy	5	s æ n d iː
SANDEL	s ae n d l	5	s æ n d l
SANDER	s ae n d ax	5	s æ n d ə
SANDES	s ae n d z	5	s æ n d z
SANDI	s ae n d iy	5	s æ n d iː
SANDIA	s ae n d ia	5	s æ n d ɪə
SANDIE	s ae n d iy	5	s æ n d iː
SANDIER	s ae n d ia	5	s æ n d ɪə
SANDLE	s ae n d l	5	s æ n d l
SANDO	s ae n d ow	5	s æ n d əʉ
SANDORE	s ae n d ao	5	s æ n d oː
SANDOW	s ae n d aw	5	s æ n d æɔ
SANDS	s ae n d z	5	s æ n d z
SANDY	s ae n d iy	5	s æ n d iː
SANELY	s ey n l iy	5	s æɪ n l iː
SANER	s ey n ax r	5	s æɪ n ə ɹ
SANFOR	s ae n f ax	5	s æ n f ə
SANGER	s ae ng ax r	5	s æ ŋ ə ɹ
SANGER'S	s ae ng ax z	5	s æ ŋ ə z
SANGERS	s ae ng ax z	5	s æ ŋ ə z
SANGO	s aa ng g ow	5	s ɐː ŋ g əʉ
SANIFF	s ae n ih f	5	s æ n ɪ f
SANISH	s ae n ih sh	5	s æ n ɪ ʃ
SANJAY	s ae n jh ey	5	s æ n dʒ æɪ
SANKER	s ae ng k ax	5	s æ ŋ k ə
SANKEY	s ae n k iy	5	s æ n k iː
SANKIE	s ae n k iy	5	s æ n k iː
SANKS	s ae ng k s	5	s æ ŋ k s
SANO'S	s ae n ow z	5	s æ n əʉ z
SANTA	s ae n t ax	5	s æ n t ə
SANTANTA	s ae n t ax	5	s æ n t ə
SANTE	s ae n t iy	5	s æ n t iː
SANTEE	s ae n t iy	5	s æ n t iː
SANTER	s ae n t ax	5	s æ n t ə
SANTHA	s ae n th ax	5	s æ n θ ə
SANTHI	s ae n th ay	5	s æ n θ ɑe
SANTI	s ae n t iy	5	s æ n t iː
SANTIE	s ae n t ay	5	s æ n t ɑe
SANTIER	s ae n t ia	5	s æ n t ɪə
SANTO	s ae n t ow	5	s æ n t əʉ
SANTORE	s ae n t ao	5	s æ n t oː
SANTOW	s ae n t ow	5	s æ n t əʉ
SANTY	s ae n t iy	5	s æ n t iː
SAPLEY	s ae p l ey	5	s æ p l æɪ
SAPONE	s ae p ow n	5	s æ p əʉ n
SAPPER	s ae p ax r	5	s æ p ə ɹ
SAPPER'S	s ae p ax z	5	s æ p ə z
SAPPERS	s ae p ax z	5	s æ p ə z
SAPPHIC	s ae f ih k	5	s æ f ɪ k
SAPPHIRE	s ae f ay ax	5	s æ f ɑe ə
SAPPIER	s ae p ia r	5	s æ p ɪə ɹ
SAPPING	s ae p ih ng	5	s æ p ɪ ŋ
SARA'S	s ea r ax z	5	s eː ɹ ə z
SARAH'S	s ea r ax z	5	s eː ɹ ə z
SARAHS	s ea r ax z	5	s eː ɹ ə z
SARAI'S	s ax r ay z	5	s ə ɹ ɑe z
SARDINE	s aa d iy n	5	s ɐː d iː n
SARDIS	s aa d iy z	5	s ɐː d iː z
SARDIUS	s aa d ia s	5	s ɐː d ɪə s
SARDOT	s aa d oh t	5	s ɐː d ɔ t
SARI'S	s aa r iy z	5	s ɐː ɹ iː z
SARIED	s aa r iy d	5	s ɐː ɹ iː d
SARIN	s aa r ih n	5	s ɐː ɹ ɪ n
SARIS	s aa r ih z	5	s ɐː ɹ ɪ z
SARONG	s ax r oh ng	5	s ə ɹ ɔ ŋ
SAROTTE	s ax r oh t	5	s ə ɹ ɔ t
SARTOR	s aa t ao r	5	s ɐː t oː ɹ
SARTORE	s aa t ao r	5	s ɐː t oː ɹ
SARTUS	s aa t ax s	5	s ɐː t ə s
SASH'S	s ae sh ih z	5	s æ ʃ ɪ z
SASHA'S	s ae sh ey z	5	s æ ʃ æɪ z
SASHAYS	s ae sh ay z	5	s æ ʃ ɑe z
SASHES	s ae sh ih z	5	s æ ʃ ɪ z
SASHING	s ae sh ih ng	5	s æ ʃ ɪ ŋ
SASSEN	s ae s ax n	5	s æ s ə n
SASSER	s ae s ax r	5	s æ s ə ɹ
SASSER'S	s ae s ax z	5	s æ s ə z
SASSERS	s ae s ax z	5	s æ s ə z
SASSIN	s ae s ih n	5	s æ s ɪ n
SASSING	s ae s ih ng	5	s æ s ɪ ŋ
SATAN'S	s ey t n z	5	s æɪ t n z
SATANS	s ey t n z	5	s æɪ t n z
SATCHEL'S	s ae ch l z	5	s æ tʃ l z
SATCHELED	s ae ch l d	5	s æ tʃ l d
SATCHELS	s ae ch l z	5	s æ tʃ l z
SATED	s ey t ih d	5	s æɪ t ɪ d
SATEEN	s ax t iy n	5	s ə t iː n
SATER	s ae t ax r	5	s æ t ə ɹ
SATER	s ey t ax r	5	s æɪ t ə ɹ
SATHER	s ae t hh er	5	s æ t h ɜː
SATIANS	s ey sh n z	5	s æɪ ʃ n z
SATIN	s ae t ih n	5	s æ t ɪ n
SATING	s ey t ih ng	5	s æɪ t ɪ ŋ
SATIRE	s ae t ay ax	5	s æ t ɑe ə
SATO'S	s ae t ow z	5	s æ t əʉ z
SATRAI	s ae t r iy	5	s æ t ɹ iː
SATTAR	s ae t t aa	5	s æ t t ɐː
SATTER	s ae t t er	5	s æ t t ɜː
SATURN	s ae t ax n	5	s æ t ə n
SATYR	s ae t ax r	5	s æ t ə ɹ
SATYR'S	s ae t ax z	5	s æ t ə z
SATYRS	s ae t ax z	5	s æ t ə z
SAUCE'S	s ao s ih z	5	s oː s ɪ z
SAUCER	s ao s ax r	5	s oː s ə ɹ
SAUCER'S	s ao s ax z	5	s oː s ə z
SAUCERS	s ao s ax z	5	s oː s ə z
SAUCES	s ao s ih z	5	s oː s ɪ z
SAUCIER	s ao s ia r	5	s oː s ɪə ɹ
SAUCIER'S	s ao s ia z	5	s oː s ɪə z
SAUCIERS	s ao s ia z	5	s oː s ɪə z
SAUCING	s ao s ih ng	5	s oː s ɪ ŋ
SAUDI'S	s aw d iy z	5	s æɔ d iː z
SAUDIES	s aw d iy z	5	s æɔ d iː z
SAUDIS	s aw d iy z	5	s æɔ d iː z
SAUNA'S	s aw n ax z	5	s æɔ n ə z
SAUNAS	s aw n ax z	5	s æɔ n ə z
SAUNTER	s ao n t ax	5	s oː n t ə
SAURIAN	s ao r ia n	5	s oː ɹ ɪə n
SAURUS	s ao r ax s	5	s oː ɹ ə s
SAUSAGE	s oh s ih jh	5	s ɔ s ɪ dʒ
SAUTED	s ow t ey d	5	s əʉ t æɪ d
SAUTEED	s ow t ey d	5	s əʉ t æɪ d
SAUTEES	s ow t ey z	5	s əʉ t æɪ z
SAUTER	s ow t ey ax	5	s əʉ t æɪ ə
SAUTES	s ow t ey z	5	s əʉ t æɪ z
SAUT\'EED	s ow t ey d	5	s əʉ t æɪ d
SAUT\'ES	s ow t ey z	5	s əʉ t æɪ z
SAVAGE	s ae v ih jh	5	s æ v ɪ dʒ
SAVER	s ey v ax r	5	s æɪ v ə ɹ
SAVER'S	s ey v ax z	5	s æɪ v ə z
SAVERS	s ey v ax z	5	s æɪ v ə z
SAVIN	s ey v ih n	5	s æɪ v ɪ n
SAVING	s ey v ih ng	5	s æɪ v ɪ ŋ
SAVIOUR	s ey v ia r	5	s æɪ v ɪə ɹ
SAVIOUR'S	s ey v ia z	5	s æɪ v ɪə z
SAVIOURS	s ey v ia z	5	s æɪ v ɪə z
SAVITCH	s aa v ih ch	5	s ɐː v ɪ tʃ
SAVOIR	s ae v w aa	5	s æ v w ɐː
SAVOR	s ey v ax r	5	s æɪ v ə ɹ
SAVOUR	s ey v ax r	5	s æɪ v ə ɹ
SAVOURED	s ey v ax d	5	s æɪ v ə d
SAVOURER	s ey v ax ax	5	s æɪ v ə ə
SAVOURS	s ey v ax z	5	s æɪ v ə z
SAVOY'S	s ax v oy z	5	s ə v oɪ z
SAVOYED	s ax v oy d	5	s ə v oɪ d
SAVOYS	s ax v oy z	5	s ə v oɪ z
SAVVY'S	s ae v iy z	5	s æ v iː z
SAW-HORSE	s ao hh ao s	5	s oː h oː s
SAW-MILL	s ao m ih l	5	s oː m ɪ l
SAW-PIT	s ao p ih t	5	s oː p ɪ t
SAWBUCK	s ao b ah k	5	s oː b ɐ k
SAWDERS	s ao d ax z	5	s oː d ə z
SAWDON	s ao d oh n	5	s oː d ɔ n
SAWERS	s ao ax r z	5	s oː ə ɹ z
SAWFISH	s ao f ih sh	5	s oː f ɪ ʃ
SAWFLY	s ao f l ay	5	s oː f l ɑe
SAWHILL	s ao hh ih l	5	s oː h ɪ l
SAWHORSE	s ao hh ao s	5	s oː h oː s
SAWMILL	s ao m ih l	5	s oː m ɪ l
SAWTEETH	s ao t iy th	5	s oː t iː θ
SAWTELL	s ao t eh l	5	s oː t e l
SAWTELLE	s ao t eh l	5	s oː t e l
SAWTOOTH	s ao t uw th	5	s oː t ʉː θ
SAWYER	s ao y ax r	5	s oː j ə ɹ
SAWYER'S	s ao y ax z	5	s oː j ə z
SAWYERS	s ao y ax z	5	s oː j ə z
SAXER	s ae k s ax	5	s æ k s ə
SAXON	s ae k s n	5	s æ k s n
SAYABLE	s ey ey b l	5	s æɪ æɪ b l
SAYER'S	s ey ax r z	5	s æɪ ə ɹ z
SAYERS	s ey ax r z	5	s æɪ ə ɹ z
SAYEST	s ey ih s t	5	s æɪ ɪ s t
SAYING'S	s ey ih ng z	5	s æɪ ɪ ŋ z
