lex	beep	length	hce
DESPER	d eh s p ax	5	d e s p ə
DESPIE	d eh z p ay	5	d e z p ɑe
DESSAUER	d eh s aw ax	5	d e s æɔ ə
DESSAUR	d eh s aw ax	5	d e s æɔ ə
DESSERT	d ih z er t	5	d ɪ z ɜː t
DESTAIN	d ey t ey n	5	d æɪ t æɪ n
DESTER	d eh z t er	5	d e z t ɜː
DETACH	d ih t ae ch	5	d ɪ t æ tʃ
DETAIL	d iy t ey l	5	d iː t æɪ l
DETAIN	d ih t ey n	5	d ɪ t æɪ n
DETER	d ih t er r	5	d ɪ t ɜː ɹ
DETERED	d ih t er d	5	d ɪ t ɜː d
DETERRED	d ih t er d	5	d ɪ t ɜː d
DETERS	d ih t er z	5	d ɪ t ɜː z
DETOUR	d iy t ua r	5	d iː t ʊə ɹ
DETOURED	d iy t ua d	5	d iː t ʊə d
DETOURS	d iy t ua z	5	d iː t ʊə z
DETRAY	d ih t r ey	5	d ɪ t ɹ æɪ
DETROY	d ih t r oy	5	d ɪ t ɹ oɪ
DEUCED	d y uw s t	5	d j ʉː s t
DEUMS	d iy ax m z	5	d iː ə m z
DEUTER	d y uw t ax	5	d j ʉː t ə
DEVA'S	d ey v ax z	5	d æɪ v ə z
DEVAS	d ey v ax z	5	d æɪ v ə z
DEVICE	d ih v ay s	5	d ɪ v ɑe s
DEVIL'S	d eh v l z	5	d e v l z
DEVILED	d eh v l d	5	d e v l d
DEVILLED	d eh v l d	5	d e v l d
DEVILS	d eh v l z	5	d e v l z
DEVILS'	d eh v l z	5	d e v l z
DEVIOUS	d iy v ia s	5	d iː v ɪə s
DEVISE	d ih v ay z	5	d ɪ v ɑe z
DEVOICE	d iy v oy s	5	d iː v oɪ s
DEVOID	d ih v oy d	5	d ɪ v oɪ d
DEVON'S	d eh v n z	5	d e v n z
DEVONS	d eh v n z	5	d e v n z
DEVOTE	d ih v ow t	5	d ɪ v əʉ t
DEVOUR	d ih v aw ax	5	d ɪ v æɔ ə
DEVOUT	d ih v aw t	5	d ɪ v æɔ t
DEWALL	d y uw ao l	5	d j ʉː oː l
DEWAN	d ih w aa n	5	d ɪ w ɐː n
DEWART	d y uw aa t	5	d j ʉː ɐː t
DEWELL	d y uw eh l	5	d j ʉː e l
DEWIER	d y uw ia r	5	d j ʉː ɪə ɹ
DEWING	d y uw ih ng	5	d j ʉː ɪ ŋ
DEYTON	d ey t ah n	5	d æɪ t ɐ n
DE_TROP	d ax t r ow	5	d ə t ɹ əʉ
DHOBIED	d ow b iy d	5	d əʉ b iː d
DHOBIS	d ow b iy z	5	d əʉ b iː z
DHOTIS	d ow t ih z	5	d əʉ t ɪ z
DIAL'S	d ay ax l z	5	d ɑe ə l z
DIALED	d ay ax l d	5	d ɑe ə l d
DIALER	d ay ax l ax	5	d ɑe ə l ə
DIALLED	d ay ax l d	5	d ɑe ə l d
DIALS	d ay ax l z	5	d ɑe ə l z
DIANA	d ay ae n ax	5	d ɑe æ n ə
DIANNA	d ay ae n ax	5	d ɑe æ n ə
DIAPER	d ay ax p ax	5	d ɑe ə p ə
DIARCHY	d ay aa k iy	5	d ɑe ɐː k iː
DIARRHEA	d ay ax r ia	5	d ɑe ə ɹ ɪə
DIARRHOEA	d ay ax r ia	5	d ɑe ə ɹ ɪə
DIARY	d ay ax r iy	5	d ɑe ə ɹ iː
DIBART	d ih b aa t	5	d ɪ b ɐː t
DIBBER	d ih b ax r	5	d ɪ b ə ɹ
DIBBERS	d ih b ax z	5	d ɪ b ə z
DIBBLE'S	d ih b l z	5	d ɪ b l z
DIBBLED	d ih b l d	5	d ɪ b l d
DIBBLES	d ih b l z	5	d ɪ b l z
DIBELL	d ih b eh l	5	d ɪ b e l
DIBLER	d ih b l ax	5	d ɪ b l ə
DIBLES	d ih b l z	5	d ɪ b l z
DICATE	d ih k ey t	5	d ɪ k æɪ t
DICE'S	d ay s ih z	5	d ɑe s ɪ z
DICER	d ay s ax r	5	d ɑe s ə ɹ
DICERS	d ay s ax z	5	d ɑe s ə z
DICES	d ay s ih z	5	d ɑe s ɪ z
DICEY'S	d ay s iy z	5	d ɑe s iː z
DICING	d ay s ih ng	5	d ɑe s ɪ ŋ
DICKE'S	d ih k iy z	5	d ɪ k iː z
DICKELL	d ih k eh l	5	d ɪ k e l
DICKEN	d ih k ih n	5	d ɪ k ɪ n
DICKER	d ih k ax r	5	d ɪ k ə ɹ
DICKER'S	d ih k ax z	5	d ɪ k ə z
DICKERED	d ih k ax d	5	d ɪ k ə d
DICKERS	d ih k ax z	5	d ɪ k ə z
DICKEY'S	d ih k iy z	5	d ɪ k iː z
DICKEYS	d ih k ih z	5	d ɪ k ɪ z
DICKIES	d ih k ih z	5	d ɪ k ɪ z
DICKIN	d ih k ih n	5	d ɪ k ɪ n
DICKING	d ih k ih ng	5	d ɪ k ɪ ŋ
DICKISH	d ih k ih sh	5	d ɪ k ɪ ʃ
DICKY'S	d ih k iy z	5	d ɪ k iː z
DICOT	d ay k oh t	5	d ɑe k ɔ t
DICTA	d ih k t ax	5	d ɪ k t ə
DICTACTOR	d ih k t ax	5	d ɪ k t ə
DICTION	d ih k sh n	5	d ɪ k ʃ n
DICTOR	d ih k t ax	5	d ɪ k t ə
DICUS	d ih k ax s	5	d ɪ k ə s
DIDDLED	d ih d l d	5	d ɪ d l d
DIDDLES	d ih d l z	5	d ɪ d l z
DIDDLEY	d ih d l iy	5	d ɪ d l iː
DIDDLY	d ih d l iy	5	d ɪ d l iː
DIDI'S	d ih d ay z	5	d ɪ d ɑe z
DIDN'T	d ih d n t	5	d ɪ d n t
DIDNAE	d ih d n iy	5	d ɪ d n iː
DIDO'S	d ih d ow z	5	d ɪ d əʉ z
DIDOES	d ih d ow z	5	d ɪ d əʉ z
DIDOS	d ih d ow z	5	d ɪ d əʉ z
DIE-HARD	d ay hh aa d	5	d ɑe h ɐː d
DIEDER	d ay d ax r	5	d ɑe d ə ɹ
DIEGO	d ih ey g ow	5	d ɪ æɪ g əʉ
DIEING	d ay iy ih ng	5	d ɑe iː ɪ ŋ
DIESEL'S	d iy z l z	5	d iː z l z
DIESELS	d iy z l z	5	d iː z l z
DIESING	d ay z ih ng	5	d ɑe z ɪ ŋ
DIET'S	d ay ax t s	5	d ɑe ə t s
DIETER	d ay ax t ax	5	d ɑe ə t ə
DIETES	d ay ax t s	5	d ɑe ə t s
DIETS	d ay ax t s	5	d ɑe ə t s
DIFFER	d ih f ax r	5	d ɪ f ə ɹ
DIFFERED	d ih f ax d	5	d ɪ f ə d
DIFFERER	d ih f ax ax	5	d ɪ f ə ə
DIFFERES	d ih f ax z	5	d ɪ f ə z
DIFFERS	d ih f ax z	5	d ɪ f ə z
DIFFIN	d ih f ih n	5	d ɪ f ɪ n
DIGATE	d ih g eh t	5	d ɪ g e t
DIGGER	d ih g ax r	5	d ɪ g ə ɹ
DIGGER'S	d ih g ax z	5	d ɪ g ə z
DIGGERS	d ih g ax z	5	d ɪ g ə z
DIGGING	d ih g ih ng	5	d ɪ g ɪ ŋ
DIGHTED	d ay t ih d	5	d ɑe t ɪ d
DIGIT	d ih jh ih t	5	d ɪ dʒ ɪ t
DIJON	d iy zh oh ng	5	d iː ʒ ɔ ŋ
DIKER	d ay k ax r	5	d ɑe k ə ɹ
DIKERS	d ay k ax z	5	d ɑe k ə z
DIKING	d ay k ih ng	5	d ɑe k ɪ ŋ
DILATE	d ay l ey t	5	d ɑe l æɪ t
DILIP	d ih l ih p	5	d ɪ l ɪ p
DILLAS	d ih l ax z	5	d ɪ l ə z
DILLER	d ih l ax r	5	d ɪ l ə ɹ
DILLER'S	d ih l ax z	5	d ɪ l ə z
DILLERS	d ih l ax z	5	d ɪ l ə z
DILLIN	d ih l ih n	5	d ɪ l ɪ n
DILLING	d ih l ih ng	5	d ɪ l ɪ ŋ
DILLYS	d ih l iy z	5	d ɪ l iː z
DIMARE	d ih m aa r	5	d ɪ m ɐː ɹ
DIMARK	d ih m aa k	5	d ɪ m ɐː k
DIMBAR	d ih m b aa	5	d ɪ m b ɐː
DIMBER	d ih m b ax	5	d ɪ m b ə
DIMBLE	d ih m b l	5	d ɪ m b l
DIMEING	d ay m ih ng	5	d ɑe m ɪ ŋ
DIMER	d ay m ax r	5	d ɑe m ə ɹ
DIMER	d ih m ax r	5	d ɪ m ə ɹ
DIMERS	d ay m ax z	5	d ɑe m ə z
DIMERS	d ih m ax z	5	d ɪ m ə z
DIMICK	d ih m ih k	5	d ɪ m ɪ k
DIMING	d ih m ih ng	5	d ɪ m ɪ ŋ
DIMLY	d ih m l iy	5	d ɪ m l iː
DIMMER	d ih m ax r	5	d ɪ m ə ɹ
DIMMER'S	d ih m ax z	5	d ɪ m ə z
DIMMERS	d ih m ax z	5	d ɪ m ə z
DIMMICK	d ih m ih k	5	d ɪ m ɪ k
DIMMING	d ih m ih ng	5	d ɪ m ɪ ŋ
DIMMISH	d ih m ih sh	5	d ɪ m ɪ ʃ
DIMNER	d ih m n ax	5	d ɪ m n ə
DIMOUT	d ih m aw t	5	d ɪ m æɔ t
DIMPER	d ih m p ax	5	d ɪ m p ə
DIMPLE	d ih m p l	5	d ɪ m p l
DIMSEY	d ih m z iy	5	d ɪ m z iː
DINA'S	d ih n ey z	5	d ɪ n æɪ z
DINAN	d ih n ae n	5	d ɪ n æ n
DINAR	d iy n aa r	5	d iː n ɐː ɹ
DINAR'S	d iy n aa z	5	d iː n ɐː z
DINARD	d iy n aa d	5	d iː n ɐː d
DINARS	d iy n aa z	5	d iː n ɐː z
DINDA	d ih n d ax	5	d ɪ n d ə
DINDLE	d ih n d l	5	d ɪ n d l
DINEAGE	d ay n ey jh	5	d ɑe n æɪ dʒ
DINER	d ay n ax r	5	d ɑe n ə ɹ
DINER'S	d ay n ax z	5	d ɑe n ə z
DINERS	d ay n ax z	5	d ɑe n ə z
DINGEE	d ih n jh iy	5	d ɪ n dʒ iː
DINGELL	d ih ng eh l	5	d ɪ ŋ e l
DINGER	d ih ng ax r	5	d ɪ ŋ ə ɹ
DINGERS	d ih ng ax z	5	d ɪ ŋ ə z
DINGESS	d ih ng eh s	5	d ɪ ŋ e s
DINGEY	d ih ng g iy	5	d ɪ ŋ g iː
DINGHY	d ih ng g iy	5	d ɪ ŋ g iː
DINGIER	d ih n jh ia	5	d ɪ n dʒ ɪə
DINGING	d ih ng ih ng	5	d ɪ ŋ ɪ ŋ
DINGLE	d ih ng g l	5	d ɪ ŋ g l
DINGLEY	d ih ng l ey	5	d ɪ ŋ l æɪ
DINGLY	d ih ng l iy	5	d ɪ ŋ l iː
DINGO	d ih ng g ow	5	d ɪ ŋ g əʉ
DINGY	d ih n jh iy	5	d ɪ n dʒ iː
DINGY	d ih ng g iy	5	d ɪ ŋ g iː
DINI'S	d ih n ay z	5	d ɪ n ɑe z
DINING	d ay n ih ng	5	d ɑe n ɪ ŋ
DINKEY	d ih n k iy	5	d ɪ n k iː
DINKIER	d ih ng k ia	5	d ɪ ŋ k ɪə
DINKLE	d ih ng k l	5	d ɪ ŋ k l
DINKY	d ih ng k iy	5	d ɪ ŋ k iː
DINNER	d ih n ax r	5	d ɪ n ə ɹ
DINNER'S	d ih n ax z	5	d ɪ n ə z
DINNERS	d ih n ax z	5	d ɪ n ə z
DINNIES	d ih n ih z	5	d ɪ n ɪ z
DINNING	d ih n ih ng	5	d ɪ n ɪ ŋ
DINO'S	d ih n ow z	5	d ɪ n əʉ z
DINSER	d ih n z ax	5	d ɪ n z ə
DINSEY	d ih n z iy	5	d ɪ n z iː
DINTER	d ih n t ax	5	d ɪ n t ə
DINTS	d ih n t s	5	d ɪ n t s
DION'S	d ay ax n z	5	d ɑe ə n z
DIPHONE	d ih f ow n	5	d ɪ f əʉ n
DIPOLE	d ay p ow l	5	d ɑe p əʉ l
DIPPER	d ih p ax r	5	d ɪ p ə ɹ
DIPPER'S	d ih p ax z	5	d ɪ p ə z
DIPPERS	d ih p ax z	5	d ɪ p ə z
DIPPIER	d ih p p ia	5	d ɪ p p ɪə
DIPPIN	d ih p ih n	5	d ɪ p ɪ n
DIPPING	d ih p ih ng	5	d ɪ p ɪ ŋ
DIPTER	d ih p t ax	5	d ɪ p t ə
DIP_ED	d ih p eh d	5	d ɪ p e d
DIRE'S	d ay ax r z	5	d ɑe ə ɹ z
DIRER	d ay ax r ax	5	d ɑe ə ɹ ə
DIRGE'S	d er jh ih z	5	d ɜː dʒ ɪ z
DIRGES	d er jh ih z	5	d ɜː dʒ ɪ z
DIRICK	d ih r ih k	5	d ɪ ɹ ɪ k
DIRKIN	d er k ih n	5	d ɜː k ɪ n
DIRKING	d er k ih ng	5	d ɜː k ɪ ŋ
DIRNDL	d er n d l	5	d ɜː n d l
DIRNDLE	d er n d l	5	d ɜː n d l
DIRTIED	d er t ih d	5	d ɜː t ɪ d
DIRTIER	d er t ia r	5	d ɜː t ɪə ɹ
DIRTIES	d er t ih z	5	d ɜː t ɪ z
DIRTING	d er t ih ng	5	d ɜː t ɪ ŋ
DISARM	d ih s aa m	5	d ɪ s ɐː m
DISBAR	d ih s b aa	5	d ɪ s b ɐː
DISC'S	d ih s k s	5	d ɪ s k s
DISCAL	d ih s k l	5	d ɪ s k l
DISCED	d ih s k t	5	d ɪ s k t
DISCERN	d ih s er n	5	d ɪ s ɜː n
DISCERNE	d ih s er n	5	d ɪ s ɜː n
DISCI	d ih s k ay	5	d ɪ s k ɑe
DISCO	d ih s k ow	5	d ɪ s k əʉ
DISCS	d ih s k s	5	d ɪ s k s
DISEASE	d ih z iy z	5	d ɪ z iː z
DISH'S	d ih sh ih z	5	d ɪ ʃ ɪ z
DISHER	d ih sh ax r	5	d ɪ ʃ ə ɹ
DISHER'S	d ih sh ax z	5	d ɪ ʃ ə z
DISHES	d ih sh ih z	5	d ɪ ʃ ɪ z
DISHIER	d ih sh ia r	5	d ɪ ʃ ɪə ɹ
DISHING	d ih sh ih ng	5	d ɪ ʃ ɪ ŋ
DISHWARE	d ih sh w ea	5	d ɪ ʃ w eː
DISK'S	d ih s k s	5	d ɪ s k s
DISKED	d ih s k t	5	d ɪ s k t
DISKES	d ih s k s	5	d ɪ s k s
DISKEY	d ih s k iy	5	d ɪ s k iː
DISKS	d ih s k s	5	d ɪ s k s
DISMAY	d ih s m ey	5	d ɪ s m æɪ
DISOWN	d ih s ow n	5	d ɪ s əʉ n
DISPED	d ih s p t	5	d ɪ s p t
DISQUES	d ih s k s	5	d ɪ s k s
DISSING	d ih s ih ng	5	d ɪ s ɪ ŋ
DISTR	d ih s t ax	5	d ɪ s t ə
DITCH'S	d ih ch ih z	5	d ɪ tʃ ɪ z
DITCHERS	d ih ch ax z	5	d ɪ tʃ ə z
DITCHES	d ih ch ih z	5	d ɪ tʃ ɪ z
DITCHING	d ih ch ih ng	5	d ɪ tʃ ɪ ŋ
DITHER	d ih dh ax r	5	d ɪ ð ə ɹ
DITHERED	d ih dh ax d	5	d ɪ ð ə d
DITHERS	d ih dh ax z	5	d ɪ ð ə z
DITTIES	d ih t ih z	5	d ɪ t ɪ z
DITTO'S	d ih t ow z	5	d ɪ t əʉ z
DITTOED	d ih t ow d	5	d ɪ t əʉ d
DITTOES	d ih t ow z	5	d ɪ t əʉ z
DITTOS	d ih t ow z	5	d ɪ t əʉ z
DITTY'S	d ih t iy z	5	d ɪ t iː z
DITTYES	d ih t iy z	5	d ɪ t iː z
DIURNAL	d ay er n l	5	d ɑe ɜː n l
DIVA'S	d iy v ax z	5	d iː v ə z
DIVAD	d iy v ax d	5	d iː v ə d
DIVAN	d ih v ae n	5	d ɪ v æ n
DIVAS	d iy v ax z	5	d iː v ə z
DIVELEY	d ay v l ey	5	d ɑe v l æɪ
DIVER	d ay v ax r	5	d ɑe v ə ɹ
DIVER'S	d ay v ax z	5	d ɑe v ə z
DIVERED	d ay v ax d	5	d ɑe v ə d
DIVERGE	d ay v er jh	5	d ɑe v ɜː dʒ
DIVERS	d ay v ax z	5	d ɑe v ə z
DIVERS	d ay v er z	5	d ɑe v ɜː z
DIVERSE	d ay v er s	5	d ɑe v ɜː s
DIVERT	d ay v er t	5	d ɑe v ɜː t
DIVES	d ay v iy z	5	d ɑe v iː z
DIVIDE	d ih v ay d	5	d ɪ v ɑe d
DIVINE	d ih v ay n	5	d ɪ v ɑe n
DIVING	d ay v ih ng	5	d ɑe v ɪ ŋ
DIVIS	d ih v ih s	5	d ɪ v ɪ s
DIVORCE	d ih v ao s	5	d ɪ v oː s
DIVOT	d ih v ax t	5	d ɪ v ə t
DIVVIED	d ih v ih d	5	d ɪ v ɪ d
DIVVIES	d ih v ih z	5	d ɪ v ɪ z
DIWAN	d ih w aa n	5	d ɪ w ɐː n
DIXIE	d ih k s iy	5	d ɪ k s iː
DIXON	d ih k s n	5	d ɪ k s n
DIZZIED	d ih z ih d	5	d ɪ z ɪ d
DIZZIER	d ih z ia r	5	d ɪ z ɪə ɹ
DIZZIES	d ih z ih z	5	d ɪ z ɪ z
DIZZY'S	d ih z iy z	5	d ɪ z iː z
DLITT	d iy l ih t	5	d iː l ɪ t
DOBBIES	d oh b ih z	5	d ɔ b ɪ z
DOBBIN	d oh b ih n	5	d ɔ b ɪ n
DOBBING	d oh b ih ng	5	d ɔ b ɪ ŋ
DOCILE	d ow s ay l	5	d əʉ s ɑe l
DOCKAGE	d oh k ih jh	5	d ɔ k ɪ dʒ
DOCKER	d oh k ax r	5	d ɔ k ə ɹ
DOCKER'S	d oh k ax z	5	d ɔ k ə z
DOCKERS	d oh k ax z	5	d ɔ k ə z
DOCKET	d oh k ih t	5	d ɔ k ɪ t
DOCKING	d oh k ih ng	5	d ɔ k ɪ ŋ
DOCKTER	d oh k t er	5	d ɔ k t ɜː
DOCTER	d oh k t ax	5	d ɔ k t ə
DOCTOR	d oh k t ax	5	d ɔ k t ə
DODDER	d oh d ax r	5	d ɔ d ə ɹ
DODDER'S	d oh d ax z	5	d ɔ d ə z
DODDERED	d oh d ax d	5	d ɔ d ə d
DODDERS	d oh d ax z	5	d ɔ d ə z
DODGE'S	d oh jh ih z	5	d ɔ dʒ ɪ z
DODGEM	d oh jh ax m	5	d ɔ dʒ ə m
DODGER	d oh jh ax r	5	d ɔ dʒ ə ɹ
DODGER'S	d oh jh ax z	5	d ɔ dʒ ə z
DODGERS	d oh jh ax z	5	d ɔ dʒ ə z
DODGERS'	d oh jh ax z	5	d ɔ dʒ ə z
DODGES	d oh jh ih z	5	d ɔ dʒ ɪ z
DODGING	d oh jh ih ng	5	d ɔ dʒ ɪ ŋ
DODO'S	d ow d ow z	5	d əʉ d əʉ z
DODOES	d ow d ow z	5	d əʉ d əʉ z
DODOS	d ow d ow z	5	d əʉ d əʉ z
DOEBEL	d ow b eh l	5	d əʉ b e l
DOEDEN	d ow d eh n	5	d əʉ d e n
DOER'S	d uw ax r z	5	d ʉː ə ɹ z
DOERING	d uw ax ih ng	5	d ʉː ə ɪ ŋ
DOERR'S	d uw ax aa z	5	d ʉː ə ɐː z
DOESN'T	d ah z n t	5	d ɐ z n t
DOEST	d uw ih s t	5	d ʉː ɪ s t
DOFFERS	d oh f ax z	5	d ɔ f ə z
DOFFIN	d oh f ih n	5	d ɔ f ɪ n
DOFFING	d oh f ih ng	5	d ɔ f ɪ ŋ
DOG-EARED	d oh g ia d	5	d ɔ g ɪə d
DOGE'S	d ow jh ih z	5	d əʉ dʒ ɪ z
DOGEARED	d oh g ia d	5	d ɔ g ɪə d
DOGEARS	d oh g ia z	5	d ɔ g ɪə z
DOGES	d ow jh ih z	5	d əʉ dʒ ɪ z
DOGGED	d oh g ih d	5	d ɔ g ɪ d
DOGGERS	d oh g ax z	5	d ɔ g ə z
DOGGIE'S	d oh g iy z	5	d ɔ g iː z
DOGGIER	d oh g iy ax	5	d ɔ g iː ə
DOGGIES	d oh g ih z	5	d ɔ g ɪ z
DOGGIN	d oh g ih n	5	d ɔ g ɪ n
DOGGING	d oh g ih ng	5	d ɔ g ɪ ŋ
DOGGISH	d oh g ih sh	5	d ɔ g ɪ ʃ
DOGGY'S	d oh g iy z	5	d ɔ g iː z
DOGMA	d oh g m ax	5	d ɔ g m ə
DOHMAN	d ow m ae n	5	d əʉ m æ n
DOHMANN	d ow m ae n	5	d əʉ m æ n
DOHMEN	d ow m eh n	5	d əʉ m e n
DOHRING	d ow r ih ng	5	d əʉ ɹ ɪ ŋ
DOILIES	d oy l ih z	5	d oɪ l ɪ z
DOING'S	d uw ih ng z	5	d ʉː ɪ ŋ z
DOINGES	d uw ih ng z	5	d ʉː ɪ ŋ z
DOINGS	d uw ih ng z	5	d ʉː ɪ ŋ z
DOITED	d oy t ih d	5	d oɪ t ɪ d
DOLCE	d oh l ch iy	5	d ɔ l tʃ iː
DOLDER	d oh l d ax	5	d ɔ l d ə
DOLING	d ow l ih ng	5	d əʉ l ɪ ŋ
DOLLAN	d oh l ax n	5	d ɔ l ə n
DOLLAR	d oh l ax r	5	d ɔ l ə ɹ
DOLLAR'S	d oh l ax z	5	d ɔ l ə z
DOLLARD	d oh l ax d	5	d ɔ l ə d
DOLLARS	d oh l ax z	5	d ɔ l ə z
DOLLAS	d oh l ax z	5	d ɔ l ə z
DOLLER	d oh l ax r	5	d ɔ l ə ɹ
DOLLERS	d oh l ax z	5	d ɔ l ə z
DOLLIED	d oh l ih d	5	d ɔ l ɪ d
DOLLIES	d oh l ih z	5	d ɔ l ɪ z
DOLLING	d oh l ih ng	5	d ɔ l ɪ ŋ
DOLLOFF	d oh l ao f	5	d ɔ l oː f
DOLLOP	d oh l ax p	5	d ɔ l ə p
DOLLY'S	d oh l iy z	5	d ɔ l iː z
DOLLYS	d oh l iy z	5	d ɔ l iː z
DOLMAR	d oh l m ax	5	d ɔ l m ə
DOLORES	d ow l ax z	5	d əʉ l ə z
DOLORS	d ow l ax z	5	d əʉ l ə z
DOLOUR	d oh l ax r	5	d ɔ l ə ɹ
DOLOURS	d oh l ax z	5	d ɔ l ə z
DOLPH'S	d oh l f s	5	d ɔ l f s
DOLT'S	d ow l t s	5	d əʉ l t s
DOLTER	d ow l t ax	5	d əʉ l t ə
DOLTS	d ow l t s	5	d əʉ l t s
DOMAIN	d ow m ey n	5	d əʉ m æɪ n
DOMAINE	d ow m ey n	5	d əʉ m æɪ n
DOMER	d ow m ax r	5	d əʉ m ə ɹ
DOMERS	d ow m ax z	5	d əʉ m ə z
DOMETT	d ow m eh t	5	d əʉ m e t
DOMING	d ax m ih ng	5	d ə m ɪ ŋ
DOMITE	d ax m ay t	5	d ə m ɑe t
DON'T'S	d ow n t s	5	d əʉ n t s
DON'TS	d ow n t s	5	d əʉ n t s
DONA'S	d ow n ax z	5	d əʉ n ə z
DONAHER	d ow n ax ax	5	d əʉ n ə ə
DONALD	d oh n l d	5	d ɔ n l d
DONALL	d oh n ao l	5	d ɔ n oː l
DONAR	d ow n ax ax	5	d əʉ n ə ə
DONATE	d ow n ey t	5	d əʉ n æɪ t
DONCHA	d oh ng k ax	5	d ɔ ŋ k ə
DONEES	d ow n iy z	5	d əʉ n iː z
DONEHOO	d ah n hh uw	5	d ɐ n h ʉː
DONELL	d oh n eh l	5	d ɔ n e l
DONELLE	d oh n eh l	5	d ɔ n e l
DONER	d ah n ax r	5	d ɐ n ə ɹ
DONER	d oh n ax r	5	d ɔ n ə ɹ
DONER'S	d ah n aa z	5	d ɐ n ɐː z
DONERS	d ah n ax z	5	d ɐ n ə z
DONERS	d oh n ax z	5	d ɔ n ə z
DONETTE	d ax n eh t	5	d ə n e t
DONGA	d oh ng g ax	5	d ɔ ŋ g ə
DONICE	d oh n ay s	5	d ɔ n ɑe s
DONING	d oh n ih ng	5	d ɔ n ɪ ŋ
DONKEY	d oh ng k iy	5	d ɔ ŋ k iː
DONLEY	d oh n l ey	5	d ɔ n l æɪ
DONNA'S	d oh n ax z	5	d ɔ n ə z
DONNAR	d oh n ax ax	5	d ɔ n ə ə
DONNAS	d oh n ax z	5	d ɔ n ə z
DONNAY	d oh n n ey	5	d ɔ n n æɪ
DONNING	d oh n ih ng	5	d ɔ n ɪ ŋ
DONNISH	d oh n ih sh	5	d ɔ n ɪ ʃ
DONOR	d ow n ax r	5	d əʉ n ə ɹ
DONOR'S	d ow n ax z	5	d əʉ n ə z
DONORS	d ow n ax z	5	d əʉ n ə z
DOODLE'S	d uw d l z	5	d ʉː d l z
DOODLED	d uw d l d	5	d ʉː d l d
DOODLER	d uw d l ax	5	d ʉː d l ə
DOODLES	d uw d l z	5	d ʉː d l z
DOOMING	d uw m ih ng	5	d ʉː m ɪ ŋ
DOOR-CASE	d ao k ey s	5	d oː k æɪ s
DOOR-KNOB	d ao n oh b	5	d oː n ɔ b
DOOR-MAT	d ao m ae t	5	d oː m æ t
DOOR-NAIL	d ao n ey l	5	d oː n æɪ l
DOORBELL	d ao b eh l	5	d oː b e l
DOORCASE	d ao k ey s	5	d oː k æɪ s
DOORKEEP	d ao k iy p	5	d oː k iː p
DOORKEY	d ao r k iy	5	d oː ɹ k iː
DOORKNOB	d ao n oh b	5	d oː n ɔ b
DOORKNOCK	d ao n oh k	5	d oː n ɔ k
DOORMAN	d ao m ae n	5	d oː m æ n
DOORMAT	d ao m ae t	5	d oː m æ t
DOORMEN	d ao m eh n	5	d oː m e n
DOORMOUSE	d ao m aw s	5	d oː m æɔ s
DOORNAIL	d ao n ey l	5	d oː n æɪ l
DOORS'S	d ao z ih z	5	d oː z ɪ z
DOORWAY'S	d ao w ey z	5	d oː w æɪ z
DOORWAYS	d ao w ey z	5	d oː w æɪ z
DOPER'S	d ow p ax z	5	d əʉ p ə z
DOPERS	d ow p ax z	5	d əʉ p ə z
DOPEY'S	d ow p iy z	5	d əʉ p iː z
DOPING	d ow p ih ng	5	d əʉ p ɪ ŋ
DORA'S	d ao r ax z	5	d oː ɹ ə z
DORAL	d ao r ax l	5	d oː ɹ ə l
DORCAS	d ao k ax s	5	d oː k ə s
DORCASE	d ao k ey s	5	d oː k æɪ s
DORE'S	d ao r iy z	5	d oː ɹ iː z
DOREAN	d ao r ia n	5	d oː ɹ ɪə n
DOREEN	d ao r iy n	5	d oː ɹ iː n
DORER	d ao r ax r	5	d oː ɹ ə ɹ
DORESE	d ao r iy z	5	d oː ɹ iː z
DOREY'S	d ao r iy z	5	d oː ɹ iː z
DORIA'S	d ao r ia z	5	d oː ɹ ɪə z
DORIAN	d ao r ia n	5	d oː ɹ ɪə n
DORIAS	d ao r ia z	5	d oː ɹ ɪə z
DORIC	d oh r ih k	5	d ɔ ɹ ɪ k
DORICK	d oh r ih k	5	d ɔ ɹ ɪ k
DORIES	d ao r ih z	5	d oː ɹ ɪ z
DORING	d ao r ih ng	5	d oː ɹ ɪ ŋ
DORIS	d oh r ih s	5	d ɔ ɹ ɪ s
DORIS'	d oh r ih s	5	d ɔ ɹ ɪ s
DORKING	d ao k ih ng	5	d oː k ɪ ŋ
DORMA'S	d ao m ax z	5	d oː m ə z
DORMAN	d ao m ax n	5	d oː m ə n
DORMAS	d ao m ax z	5	d oː m ə z
DORMER	d ao m ax r	5	d oː m ə ɹ
DORMERED	d ao m ax d	5	d oː m ə d
DORMERS	d ao m ax z	5	d oː m ə z
DORMICE	d ao m ay s	5	d oː m ɑe s
DORMIT	d ao m ih t	5	d oː m ɪ t
DORMOUSE	d ao m aw s	5	d oː m æɔ s
DORRAN	d ao r ax n	5	d oː ɹ ə n
DORSALS	d ao s l z	5	d oː s l z
DORSET	d ao s ih t	5	d oː s ɪ t
DOSAGE	d ow s ih jh	5	d əʉ s ɪ dʒ
DOSE'S	d ow s ih z	5	d əʉ s ɪ z
DOSER	d ow s ax r	5	d əʉ s ə ɹ
DOSER	d uw z ax r	5	d ʉː z ə ɹ
DOSERS	d ow s ax z	5	d əʉ s ə z
DOSERS	d uw z ax z	5	d ʉː z ə z
DOSES	d ow s ih z	5	d əʉ s ɪ z
DOSHER	d uw z hh er	5	d ʉː z h ɜː
DOSING	d ow s ih ng	5	d əʉ s ɪ ŋ
DOSSAL	d oh s ax l	5	d ɔ s ə l
DOSSER	d oh s ax r	5	d ɔ s ə ɹ
DOSSERS	d oh s ax z	5	d ɔ s ə z
DOSSES	d oh s ih z	5	d ɔ s ɪ z
DOSSIER	d oh s ih ey	5	d ɔ s ɪ æɪ
DOSSING	d oh s ih ng	5	d ɔ s ɪ ŋ
DOSTER	d ah s t ax	5	d ɐ s t ə
DOSTIE	d uw z t ay	5	d ʉː z t ɑe
DOTAGE	d ow t ih jh	5	d əʉ t ɪ dʒ
DOTAN	d oh t ae n	5	d ɔ t æ n
DOTARD	d ow t ax d	5	d əʉ t ə d
DOTED	d ow t ih d	5	d əʉ t ɪ d
DOTERS	d ow t ax z	5	d əʉ t ə z
DOTING	d ow t ih ng	5	d əʉ t ɪ ŋ
DOTTED	d oh t ih d	5	d ɔ t ɪ d
DOTTER	d oh t t er	5	d ɔ t t ɜː
DOTTIE	d oh t t ay	5	d ɔ t t ɑe
DOTTIER	d oh t ia r	5	d ɔ t ɪə ɹ
DOTTING	d oh t ih ng	5	d ɔ t ɪ ŋ
DOTTLER	d oh t l ax	5	d ɔ t l ə
DOTTLES	d oh t l z	5	d ɔ t l z
DOTTY'S	d oh t iy z	5	d ɔ t iː z
DOUANES	d uw aa n z	5	d ʉː ɐː n z
DOUBLE'S	d ah b l z	5	d ɐ b l z
DOUBLED	d ah b l d	5	d ɐ b l d
DOUBLER	d ah b l ax	5	d ɐ b l ə
DOUBLES	d ah b l z	5	d ɐ b l z
DOUBLY	d ah b l iy	5	d ɐ b l iː
DOUBTED	d aw t ih d	5	d æɔ t ɪ d
DOUBTER'S	d aw t ax z	5	d æɔ t ə z
DOUBTERS	d aw t ax z	5	d æɔ t ə z
DOUBTING	d aw t ih ng	5	d æɔ t ɪ ŋ
DOUCHES	d uw sh ih z	5	d ʉː ʃ ɪ z
DOUGALL	d ah g ao l	5	d ɐ g oː l
DOUGHBOY'S	d ow b oy z	5	d əʉ b oɪ z
DOUGHFACE	d ow f ey s	5	d əʉ f æɪ s
DOUGHMAN	d ow m ae n	5	d əʉ m æ n
DOUGHNUT	d ow n ah t	5	d əʉ n ɐ t
DOUGHTEN	d ow t eh n	5	d əʉ t e n
DOUGHTRY	d ow t r ay	5	d əʉ t ɹ ɑe
DOUGHTY'S	d aw t iy z	5	d æɔ t iː z
DOUGHTYS	d aw t iy z	5	d æɔ t iː z
DOURER	d ua r ax r	5	d ʊə ɹ ə ɹ
DOUREST	d ua ih s t	5	d ʊə ɪ s t
DOUSER	d aw s ax r	5	d æɔ s ə ɹ
DOUSERS	d aw s ax z	5	d æɔ s ə z
DOUSES	d aw s ih z	5	d æɔ s ɪ z
DOUSING	d aw s ih ng	5	d æɔ s ɪ ŋ
DOVER	d ow v ax r	5	d əʉ v ə ɹ
DOVER'S	d ow v ax z	5	d əʉ v ə z
DOVERED	d ow v ax d	5	d əʉ v ə d
DOVERS	d ow v ax z	5	d əʉ v ə z
DOWAGER	d aw ax jh ax	5	d æɔ ə dʒ ə
DOWDIER	d aw d ia r	5	d æɔ d ɪə ɹ
DOWDIES	d aw d ih z	5	d æɔ d ɪ z
DOWDING	d aw d ih ng	5	d æɔ d ɪ ŋ
DOWDY'S	d aw d iy z	5	d æɔ d iː z
DOWEL'S	d aw ax l z	5	d æɔ ə l z
DOWELED	d aw ax l d	5	d æɔ ə l d
DOWELLED	d aw ax l d	5	d æɔ ə l d
DOWELS	d aw ax l z	5	d æɔ ə l z
DOWER'S	d aw ax r z	5	d æɔ ə ɹ z
DOWLAS	d aw l ax s	5	d æɔ l ə s
DOWNE'S	d aw n iy z	5	d æɔ n iː z
DOWNER	d aw n ax r	5	d æɔ n ə ɹ
DOWNER'S	d aw n ax z	5	d æɔ n ə z
DOWNERS	d aw n ax z	5	d æɔ n ə z
DOWNIES	d aw n ih z	5	d æɔ n ɪ z
DOWNING	d aw n ih ng	5	d æɔ n ɪ ŋ
DOWNISH	d aw n ih sh	5	d æɔ n ɪ ʃ
DOWNLIE	d aw n l ay	5	d æɔ n l ɑe
DOWNLOW	d aw n l ow	5	d æɔ n l əʉ
DOWNPOUR	d aw n p ao	5	d æɔ n p oː
DOWRY	d aw ax r iy	5	d æɔ ə ɹ iː
DOWSE'S	d aw s ih z	5	d æɔ s ɪ z
DOWSER	d aw s ax r	5	d æɔ s ə ɹ
DOWSER'S	d aw s ax z	5	d æɔ s ə z
DOWSERS	d aw s ax z	5	d æɔ s ə z
DOWSES	d aw s ih z	5	d æɔ s ɪ z
DOWSING	d aw s ih ng	5	d æɔ s ɪ ŋ
DOWSING	d aw z ih ng	5	d æɔ z ɪ ŋ
DOYENS	d oy ax n z	5	d oɪ ə n z
DOYLEYS	d oy l ih z	5	d oɪ l ɪ z
DOYLIES	d oy l ih z	5	d oɪ l ɪ z
DOZEN'S	d ah z n z	5	d ɐ z n z
DOZENED	d ah z n d	5	d ɐ z n d
DOZENS	d ah z n z	5	d ɐ z n z
DOZER'S	d ow z ax z	5	d əʉ z ə z
DOZERS	d ow z ax z	5	d əʉ z ə z
DOZES	d ow z ih z	5	d əʉ z ɪ z
DOZING	d ow z ih ng	5	d əʉ z ɪ ŋ
DPHIL	d iy f ih l	5	d iː f ɪ l
DR.	d oh k t ax	5	d ɔ k t ə
DRABBER	d r ae b ax	5	d ɹ æ b ə
DRABBLE	d r ae b l	5	d ɹ æ b l
DRABS	d r ae b z	5	d ɹ æ b z
DRACHMS	d r ae m z	5	d ɹ æ m z
DRAFT	d r aa f t	5	d ɹ ɐː f t
DRAGER	d r ae g ax	5	d ɹ æ g ə
DRAGES	d r ae g z	5	d ɹ æ g z
DRAGGED	d r ae g d	5	d ɹ æ g d
DRAGGIER	d r ae g ia	5	d ɹ æ g ɪə
DRAGGLE	d r ae g l	5	d ɹ æ g l
DRAGGY	d r ae g iy	5	d ɹ æ g iː
DRAGOUT	d r ae g uw	5	d ɹ æ g ʉː
DRAGS	d r ae g z	5	d ɹ æ g z
DRAIN'S	d r ey n z	5	d ɹ æɪ n z
DRAIND	d r ey n d	5	d ɹ æɪ n d
DRAINED	d r ey n d	5	d ɹ æɪ n d
DRAINER	d r ey n ax	5	d ɹ æɪ n ə
DRAINS	d r ey n z	5	d ɹ æɪ n z
DRAKE'S	d r ey k s	5	d ɹ æɪ k s
DRAKER	d r ey k ax	5	d ɹ æɪ k ə
DRAKES	d r ey k s	5	d ɹ æɪ k s
DRAMA	d r aa m ax	5	d ɹ ɐː m ə
DRAMMED	d r ae m d	5	d ɹ æ m d
DRAMMER	d r ae m ax	5	d ɹ æ m ə
DRAMS	d r ae m z	5	d ɹ æ m z
DRANK	d r ae ng k	5	d ɹ æ ŋ k
DRAPE'S	d r ey p s	5	d ɹ æɪ p s
DRAPED	d r ey p t	5	d ɹ æɪ p t
DRAPER	d r ey p ax	5	d ɹ æɪ p ə
DRAPES	d r ey p s	5	d ɹ æɪ p s
DRAPIER	d r ey p ia	5	d ɹ æɪ p ɪə
DRATS	d r ae t s	5	d ɹ æ t s
DRAUGHT	d r aa f t	5	d ɹ ɐː f t
DRAWAL	d r ao ax l	5	d ɹ oː ə l
DRAWBAR	d r ao b aa	5	d ɹ oː b ɐː
DRAWBORE	d r ao b ao	5	d ɹ oː b oː
DRAWER'S	d r ao r z	5	d ɹ oː ɹ z
DRAWING	d r ao ih ng	5	d ɹ oː ɪ ŋ
DRAWLED	d r ao l d	5	d ɹ oː l d
DRAWLER	d r ao l ax	5	d ɹ oː l ə
DRAWLS	d r ao l z	5	d ɹ oː l z
DRAWLY	d r ao l iy	5	d ɹ oː l iː
DRAWNS	d r ao n z	5	d ɹ oː n z
DRAYAGE	d r ey ey jh	5	d ɹ æɪ æɪ dʒ
DRAYER	d r ey ax r	5	d ɹ æɪ ə ɹ
DRAYING	d r ey ih ng	5	d ɹ æɪ ɪ ŋ
DRAYTON	d r ey t n	5	d ɹ æɪ t n
DREAD'S	d r eh d z	5	d ɹ e d z
DREADER	d r eh d ax	5	d ɹ e d ə
DREADS	d r eh d z	5	d ɹ e d z
DREAM'S	d r iy m z	5	d ɹ iː m z
DREAMD	d r iy m d	5	d ɹ iː m d
DREAMED	d r iy m d	5	d ɹ iː m d
DREAMER	d r iy m ax	5	d ɹ iː m ə
DREAMES	d r iy m z	5	d ɹ iː m z
DREAMIER	d r iy m ia	5	d ɹ iː m ɪə
DREAMS	d r iy m z	5	d ɹ iː m z
DREAMT	d r eh m t	5	d ɹ e m t
DREAMY	d r iy m iy	5	d ɹ iː m iː
DREARIER	d r ia r ia	5	d ɹ ɪə ɹ ɪə
DREARS	d r ia r z	5	d ɹ ɪə ɹ z
DREARY	d r ia r iy	5	d ɹ ɪə ɹ iː
DREDGED	d r eh jh d	5	d ɹ e dʒ d
DREDGER	d r eh jh ax	5	d ɹ e dʒ ə
DREGGY	d r eh g iy	5	d ɹ e g iː
DREGS	d r eh g z	5	d ɹ e g z
DRENCH	d r eh n ch	5	d ɹ e n tʃ
DRESER	d r eh z ax	5	d ɹ e z ə
DRESSE	d r eh s iy	5	d ɹ e s iː
DRESSED	d r eh s t	5	d ɹ e s t
DRESSER	d r eh s ax	5	d ɹ e s ə
DRESSIER	d r eh s ia	5	d ɹ e s ɪə
DRESSOR	d r eh s ax	5	d ɹ e s ə
DRESSY	d r eh s iy	5	d ɹ e s iː
DREST	d r eh s t	5	d ɹ e s t
DREWER	d r uw ax r	5	d ɹ ʉː ə ɹ
DREWER'S	d r uw ax z	5	d ɹ ʉː ə z
DRIBBED	d r ih b d	5	d ɹ ɪ b d
DRIBBLE	d r ih b l	5	d ɹ ɪ b l
DRIBS	d r ih b z	5	d ɹ ɪ b z
DRIER	d r ay ax r	5	d ɹ ɑe ə ɹ
DRIER'S	d r ay ax z	5	d ɹ ɑe ə z
DRIERS	d r ay ax z	5	d ɹ ɑe ə z
DRIFED	d r ih f t	5	d ɹ ɪ f t
DRIFT	d r ih f t	5	d ɹ ɪ f t
DRIGGER	d r ih g ax	5	d ɹ ɪ g ə
DRIGGS	d r ih g z	5	d ɹ ɪ g z
DRILL'S	d r ih l z	5	d ɹ ɪ l z
DRILLED	d r ih l d	5	d ɹ ɪ l d
DRILLER	d r ih l ax	5	d ɹ ɪ l ə
DRILLO	d r ih l ow	5	d ɹ ɪ l əʉ
DRILLS	d r ih l z	5	d ɹ ɪ l z
DRILY	d r ay l iy	5	d ɹ ɑe l iː
DRING'S	d r ih ng z	5	d ɹ ɪ ŋ z
DRINK	d r ih ng k	5	d ɹ ɪ ŋ k
DRIP'S	d r ih p s	5	d ɹ ɪ p s
DRIPPED	d r ih p t	5	d ɹ ɪ p t
DRIPPER	d r ih p ax	5	d ɹ ɪ p ə
DRIPPLE	d r ih p l	5	d ɹ ɪ p l
DRIPS	d r ih p s	5	d ɹ ɪ p s
DRIPT	d r ih p t	5	d ɹ ɪ p t
DRIVE'S	d r ay v z	5	d ɹ ɑe v z
DRIVED	d r ay v d	5	d ɹ ɑe v d
DRIVEL	d r ih v l	5	d ɹ ɪ v l
DRIVEN	d r ih v n	5	d ɹ ɪ v n
DRIVER	d r ay v ax	5	d ɹ ɑe v ə
DRIVES	d r ay v z	5	d ɹ ɑe v z
DRIZZLE	d r ih z l	5	d ɹ ɪ z l
DROGHER	d r ow g ax	5	d ɹ əʉ g ə
DROGUES	d r ow g z	5	d ɹ əʉ g z
DROID'S	d r oy d z	5	d ɹ oɪ d z
DROIDS	d r oy d z	5	d ɹ oɪ d z
DROITS	d r oy t s	5	d ɹ oɪ t s
DROLES	d r ow l z	5	d ɹ əʉ l z
DROLLER	d r ow l ax	5	d ɹ əʉ l ə
DROLLS	d r ow l z	5	d ɹ əʉ l z
DRONE'S	d r ow n z	5	d ɹ əʉ n z
DRONED	d r ow n d	5	d ɹ əʉ n d
DRONER	d r ow n ax	5	d ɹ əʉ n ə
DRONES	d r ow n z	5	d ɹ əʉ n z
DRONEY	d r ow n iy	5	d ɹ əʉ n iː
DROOL'S	d r uw l z	5	d ɹ ʉː l z
DROOLED	d r uw l d	5	d ɹ ʉː l d
DROOLS	d r uw l z	5	d ɹ ʉː l z
DROOPED	d r uw p t	5	d ɹ ʉː p t
DROOPER	d r uw p ax	5	d ɹ ʉː p ə
DROOPS	d r uw p s	5	d ɹ ʉː p s
DROP'S	d r oh p s	5	d ɹ ɔ p s
DROPED	d r oh p t	5	d ɹ ɔ p t
DROPPED	d r oh p t	5	d ɹ ɔ p t
DROPPER	d r oh p ax	5	d ɹ ɔ p ə
DROPPY	d r oh p iy	5	d ɹ ɔ p iː
DROPS	d r oh p s	5	d ɹ ɔ p s
DROSSY	d r oh s iy	5	d ɹ ɔ s iː
DROST	d r oh s t	5	d ɹ ɔ s t
DROUGHT'S	d r aw t s	5	d ɹ æɔ t s
DROUGHTS	d r aw t s	5	d ɹ æɔ t s
DROVED	d r ow v d	5	d ɹ əʉ v d
DROVER	d r ow v ax	5	d ɹ əʉ v ə
DROVES	d r ow v z	5	d ɹ əʉ v z
DROWN'S	d r aw n z	5	d ɹ æɔ n z
DROWND	d r aw n d	5	d ɹ æɔ n d
DROWNED	d r aw n d	5	d ɹ æɔ n d
