lex	beep	length	hce
KIPER'S	k ih p ax z	5	k ɪ p ə z
KIPLEY	k ih p l ey	5	k ɪ p l æɪ
KIPPER	k ih p ax r	5	k ɪ p ə ɹ
KIPPERED	k ih p ax d	5	k ɪ p ə d
KIPPERER	k ih p ax ax	5	k ɪ p ə ə
KIPPERS	k ih p ax z	5	k ɪ p ə z
KIPPIN	k ih p ih n	5	k ɪ p ɪ n
KIPPING	k ih p ih ng	5	k ɪ p ɪ ŋ
KIRIN	k ih r ih n	5	k ɪ ɹ ɪ n
KIRKBY	k er k b iy	5	k ɜː k b iː
KIRKBY'S	k er b iy z	5	k ɜː b iː z
KIRKER	k er k ax r	5	k ɜː k ə ɹ
KIRKHAM	k er k ax m	5	k ɜː k ə m
KIRKING	k er k ih ng	5	k ɜː k ɪ ŋ
KIRKLEY	k er k l ey	5	k ɜː k l æɪ
KIRSCH'S	k ia sh ih z	5	k ɪə ʃ ɪ z
KIRSCHES	k ia sh ih z	5	k ɪə ʃ ɪ z
KIRTLED	k er t l d	5	k ɜː t l d
KIRTLES	k er t l z	5	k ɜː t l z
KIRTLEY	k er t l iy	5	k ɜː t l iː
KISS'S	k ih s ih z	5	k ɪ s ɪ z
KISSACK	k ih s ae k	5	k ɪ s æ k
KISSELL	k ih s eh l	5	k ɪ s e l
KISSER	k ih s ax r	5	k ɪ s ə ɹ
KISSER'S	k ih s ax z	5	k ɪ s ə z
KISSERS	k ih s ax z	5	k ɪ s ə z
KISSES	k ih s ih z	5	k ɪ s ɪ z
KISSING	k ih s ih ng	5	k ɪ s ɪ ŋ
KITA'S	k ih t ey z	5	k ɪ t æɪ z
KITALE	k ih t ey l	5	k ɪ t æɪ l
KITCH'S	k ih ch ih z	5	k ɪ tʃ ɪ z
KITCHEN	k ih ch ih n	5	k ɪ tʃ ɪ n
KITCHES	k ih ch ih z	5	k ɪ tʃ ɪ z
KITCHIN	k ih ch ih n	5	k ɪ tʃ ɪ n
KITCHING	k ih ch ih ng	5	k ɪ tʃ ɪ ŋ
KITED	k ay t ih d	5	k ɑe t ɪ d
KITED	k ih t ih d	5	k ɪ t ɪ d
KITER	k ay t ax r	5	k ɑe t ə ɹ
KITER	k ih t ax r	5	k ɪ t ə ɹ
KITERS	k ay t ax z	5	k ɑe t ə z
KITERS	k ih t ax z	5	k ɪ t ə z
KITHING	k ih th ih ng	5	k ɪ θ ɪ ŋ
KITING	k ih t ih ng	5	k ɪ t ɪ ŋ
KITSCH'S	k ih ch ih z	5	k ɪ tʃ ɪ z
KITSCHES	k ih ch ih z	5	k ɪ tʃ ɪ z
KITTED	k ih t ih d	5	k ɪ t ɪ d
KITTEN'S	k ih t n z	5	k ɪ t n z
KITTENED	k ih t n d	5	k ɪ t n d
KITTENS	k ih t n z	5	k ɪ t n z
KITTIES	k ih t ih z	5	k ɪ t ɪ z
KITTING	k ih t ih ng	5	k ɪ t ɪ ŋ
KITTLE'S	k ih t l z	5	k ɪ t l z
KITTLED	k ih t l d	5	k ɪ t l d
KITTLER	k ih t l ax	5	k ɪ t l ə
KITTLES	k ih t l z	5	k ɪ t l z
KITTY'S	k ih t iy z	5	k ɪ t iː z
KIWI'S	k iy w iy z	5	k iː w iː z
KIWIS	k iy w iy z	5	k iː w iː z
KLEEN'S	k l iy n z	5	k l iː n z
KLEENER	k l iy n ax	5	k l iː n ə
KLEPER	k l eh p ax	5	k l e p ə
KNACKER	n ae k ax r	5	n æ k ə ɹ
KNACKER'S	n ae k ax z	5	n æ k ə z
KNACKERED	n ae k ax d	5	n æ k ə d
KNACKERS	n ae k ax z	5	n æ k ə z
KNACKING	n ae k ih ng	5	n æ k ɪ ŋ
KNAPER	n ae p ax r	5	n æ p ə ɹ
KNAPPERS	n ae p ax z	5	n æ p ə z
KNAPPING	n ae p ih ng	5	n æ p ɪ ŋ
KNAPPISH	n ae p ih sh	5	n æ p ɪ ʃ
KNARRED	n aa r eh d	5	n ɐː ɹ e d
KNAVISH	n ey v ih sh	5	n æɪ v ɪ ʃ
KNEADED	n iy d ih d	5	n iː d ɪ d
KNEADERS	n iy d ax z	5	n iː d ə z
KNEADING	n iy d ih ng	5	n iː d ɪ ŋ
KNEE-DEEP	n iy d iy p	5	n iː d iː p
KNEEBONE	n iy b ow n	5	n iː b əʉ n
KNEECAP	n iy k ae p	5	n iː k æ p
KNEEDLER	n iy d l ax	5	n iː d l ə
KNEEHOLE	n iy hh ow l	5	n iː h əʉ l
KNEELER	n iy l ax r	5	n iː l ə ɹ
KNEELERS	n iy l ax z	5	n iː l ə z
KNEELING	n iy l ih ng	5	n iː l ɪ ŋ
KNEEPAD	n iy p ae d	5	n iː p æ d
KNEEPAN	n iy p ae n	5	n iː p æ n
KNELLER	n eh l ax r	5	n e l ə ɹ
KNELLING	n eh l ih ng	5	n e l ɪ ŋ
KNICKERED	n ih k ax d	5	n ɪ k ə d
KNICKERS	n ih k ax z	5	n ɪ k ə z
KNICKING	n ih k ih ng	5	n ɪ k ɪ ŋ
KNIFE-EDGE	n ay f eh jh	5	n ɑe f e dʒ
KNIFER	n ay f ax r	5	n ɑe f ə ɹ
KNIFERS	n ay f ax z	5	n ɑe f ə z
KNIFING	n ay f ih ng	5	n ɑe f ɪ ŋ
KNIGHTAGE	n ay t ih jh	5	n ɑe t ɪ dʒ
KNIGHTED	n ay t ih d	5	n ɑe t ɪ d
KNIGHTING	n ay t ih ng	5	n ɑe t ɪ ŋ
KNIGHTLY	n ay t l iy	5	n ɑe t l iː
KNIGHTMARE	n ay t m ea	5	n ɑe t m eː
KNIGHTON	n ay t ah n	5	n ɑe t ɐ n
KNITTED	n ih t ih d	5	n ɪ t ɪ d
KNITTER	n ih t ax r	5	n ɪ t ə ɹ
KNITTER'S	n ih t ax z	5	n ɪ t ə z
KNITTERS	n ih t ax z	5	n ɪ t ə z
KNITTING	n ih t ih ng	5	n ɪ t ɪ ŋ
KNITWEAR	n ih t w ea	5	n ɪ t w eː
KNITZER	n ih t s ax	5	n ɪ t s ə
KNOBBIER	n oh b b ia	5	n ɔ b b ɪə
KNOBBLED	n oh b l d	5	n ɔ b l d
KNOBBLER	n oh b l ax	5	n ɔ b l ə
KNOBBLES	n oh b l z	5	n ɔ b l z
KNOBBLIER	n oh b l ia	5	n ɔ b l ɪə
KNOBBLY	n oh b l iy	5	n ɔ b l iː
KNOCK-ON	n oh k oh n	5	n ɔ k ɔ n
KNOCK-OUT	n oh k aw t	5	n ɔ k æɔ t
KNOCKER	n oh k ax r	5	n ɔ k ə ɹ
KNOCKER'S	n oh k ax z	5	n ɔ k ə z
KNOCKERS	n oh k ax z	5	n ɔ k ə z
KNOCKING	n oh k ih ng	5	n ɔ k ɪ ŋ
KNOCKOFF	n oh k ao f	5	n ɔ k oː f
KNOCKOUT	n oh k aw t	5	n ɔ k æɔ t
KNOLLER	n ow l ax r	5	n əʉ l ə ɹ
KNOTTED	n oh t ih d	5	n ɔ t ɪ d
KNOTTER	n oh t t er	5	n ɔ t t ɜː
KNOTTIER	n oh t ia r	5	n ɔ t ɪə ɹ
KNOTTING	n oh t ih ng	5	n ɔ t ɪ ŋ
KNOTTY'S	n oh t iy z	5	n ɔ t iː z
KNOUTED	n aw t ih d	5	n æɔ t ɪ d
KNOUTING	n aw t ih ng	5	n æɔ t ɪ ŋ
KNOW-ALLS	n ow ao l z	5	n əʉ oː l z
KNOWABLE	n ow ax b l	5	n əʉ ə b l
KNOWERS	n ow ax r z	5	n əʉ ə ɹ z
KNOWEST	n ow ih s t	5	n əʉ ɪ s t
KNOWHOWS	n ow hh aw z	5	n əʉ h æɔ z
KNOWINGER	n ow ih ng ax	5	n əʉ ɪ ŋ ə
KNOWINGS	n ow ih ng z	5	n əʉ ɪ ŋ z
KNOWLEDGE	n oh l ih jh	5	n ɔ l ɪ dʒ
KNOWLES	n ow l eh z	5	n əʉ l e z
KNOWNING	n ow n ih ng	5	n əʉ n ɪ ŋ
KNUCKLED	n ah k l d	5	n ɐ k l d
KNUCKLER	n ah k l ax	5	n ɐ k l ə
KNUCKLES	n ah k l z	5	n ɐ k l z
KNUCKLEY	n ah k l iy	5	n ɐ k l iː
KNURLED	n er l eh d	5	n ɜː l e d
KNURLING	n er l ih ng	5	n ɜː l ɪ ŋ
KNUTTER	n ah t t er	5	n ɐ t t ɜː
KOALA	k ow aa l ax	5	k əʉ ɐː l ə
KOBE'S	k ow b iy z	5	k əʉ b iː z
KOBER	k ow b iy ax	5	k əʉ b iː ə
KOBES	k ow b iy z	5	k əʉ b iː z
KOBOS	k ow b ow z	5	k əʉ b əʉ z
KODA'S	k ow d ax z	5	k əʉ d ə z
KODAK	k ow d ae k	5	k əʉ d æ k
KOHLER	k ow l ax r	5	k əʉ l ə ɹ
KOHLER'S	k ow l ax z	5	k əʉ l ə z
KOHLI'S	k ow l ay z	5	k əʉ l ɑe z
KOINES	k oy n iy z	5	k oɪ n iː z
KOLA'S	k ow l ax z	5	k əʉ l ə z
KOLAR	k ow l ax ax	5	k əʉ l ə ə
KOLAS	k ow l ax z	5	k əʉ l ə z
KOLDER	k ow l d ax	5	k əʉ l d ə
KOLN'S	k er l n z	5	k ɜː l n z
KONGING	k oh ng ih ng	5	k ɔ ŋ ɪ ŋ
KOODOOS	k uw d uw z	5	k ʉː d ʉː z
KOOKERS	k uh k ax z	5	k ʊ k ə z
KOPEC	k ow p eh k	5	k əʉ p e k
KOPECK	k ow p eh k	5	k əʉ p e k
KOPJES	k oh p ih z	5	k ɔ p ɪ z
KOPPEL	k oh p ax l	5	k ɔ p ə l
KOPPER'S	k oh p ax z	5	k ɔ p ə z
KOPPERS	k oh p ax z	5	k ɔ p ə z
KOPPIES	k oh p ih z	5	k ɔ p ɪ z
KORALE	k ax r aa l	5	k ə ɹ ɐː l
KORAN	k ax r aa n	5	k ə ɹ ɐː n
KOREA'S	k ax r ia z	5	k ə ɹ ɪə z
KOREAN	k ax r ia n	5	k ə ɹ ɪə n
KOREAS	k ax r ia z	5	k ə ɹ ɪə z
KORET	k ax r eh t	5	k ə ɹ e t
KOSHER	k ow sh ax r	5	k əʉ ʃ ə ɹ
KOSHER'S	k ow sh ax z	5	k əʉ ʃ ə z
KOSHERED	k ow sh ax d	5	k əʉ ʃ ə d
KOSHERS	k ow sh ax z	5	k əʉ ʃ ə z
KOTOWED	k aw t aw d	5	k æɔ t æɔ d
KOTOWS	k aw t aw z	5	k æɔ t æɔ z
KOUMIS	k uw m ih s	5	k ʉː m ɪ s
KOUMISS	k uw m ih s	5	k ʉː m ɪ s
KOWTOWED	k aw t aw d	5	k æɔ t æɔ d
KOWTOWER	k aw t aw ax	5	k æɔ t æɔ ə
KOWTOWS	k aw t aw z	5	k æɔ t æɔ z
KRAALS	k r aa l z	5	k ɹ ɐː l z
KRAITS	k r ay t s	5	k ɹ ɑe t s
KRIEFF'S	k r iy f s	5	k ɹ iː f s
KRIEG'S	k r iy g z	5	k ɹ iː g z
KRIEGER	k r iy g ax	5	k ɹ iː g ə
KRIVOI	k r ih v oy	5	k ɹ ɪ v oɪ
KROLL'S	k r ow l z	5	k ɹ əʉ l z
KRONA	k r ow n ax	5	k ɹ əʉ n ə
KRONE	k r ow n ax	5	k ɹ əʉ n ə
KRONER	k r ow n ax	5	k ɹ əʉ n ə
KRONOR	k r ow n ax	5	k ɹ əʉ n ə
KUDOS	k uw m ih s	5	k ʉː m ɪ s
KULLAR	k ah l ax ax	5	k ɐ l ə ə
KULLAS	k ah l ax z	5	k ɐ l ə z
KULTUR	k uh l t ua	5	k ʊ l t ʊə
KUMIS	k uw m ih s	5	k ʉː m ɪ s
KUMISS	k uw m ih s	5	k ʉː m ɪ s
KUNG_FU	k uh ng f uw	5	k ʊ ŋ f ʉː
KURSAAL	k ua z aa l	5	k ʊə z ɐː l
KUWAIT	k uh w ey t	5	k ʊ w æɪ t
KWACHA	k w ae ch ax	5	k w æ tʃ ə
KWELA	k w ey l ax	5	k w æɪ l ə
KYLER	k ay l ax r	5	k ɑe l ə ɹ
KYLIE'S	k ay l iy z	5	k ɑe l iː z
KYLIES	k ay l iy z	5	k ɑe l iː z
KYLIN	k ay l ih n	5	k ɑe l ɪ n
KYLITE	k ay l ay t	5	k ɑe l ɑe t
KYOTO	k ih ow t ow	5	k ɪ əʉ t əʉ
KYRIE	k ih r ih iy	5	k ɪ ɹ ɪ iː
L._E._A._R.	eh l iy ey ax	5	e l iː æɪ ə
L._P.S	eh l p iy z	5	e l p iː z
LAAGER	l aa g ax r	5	l ɐː g ə ɹ
LAAGERS	l aa g ax z	5	l ɐː g ə z
LABA'S	l ae b ey z	5	l æ b æɪ z
LABAND	l ae b ax n	5	l æ b ə n
LABARE	l ae b aa r	5	l æ b ɐː ɹ
LABATE	l ae b eh t	5	l æ b e t
LABE'S	l ae b iy z	5	l æ b iː z
LABEL'S	l ey b l z	5	l æɪ b l z
LABELED	l ey b l d	5	l æɪ b l d
LABELER	l ey b l ax	5	l æɪ b l ə
LABELL	l ae b eh l	5	l æ b e l
LABELLE	l ae b eh l	5	l æ b e l
LABELLED	l ey b l d	5	l æɪ b l d
LABELS	l ey b l z	5	l æɪ b l z
LABER	l ae b ax r	5	l æ b ə ɹ
LABIAL	l ey b ia l	5	l æɪ b ɪə l
LABORED	l ae b ao d	5	l æ b oː d
LABORER	l ae b ao ax	5	l æ b oː ə
LABOUR	l ey b ax r	5	l æɪ b ə ɹ
LABOUR'S	l ey b ax z	5	l æɪ b ə z
LABOURD	l ey b ax d	5	l æɪ b ə d
LABOURED	l ey b ax d	5	l æɪ b ə d
LABOURS	l ey b ax z	5	l æɪ b ə z
LABUS	l ax b ax s	5	l ə b ə s
LACE'S	l ey s ih z	5	l æɪ s ɪ z
LACER	l ae k ax r	5	l æ k ə ɹ
LACER	l ey s ax r	5	l æɪ s ə ɹ
LACER'S	l ey s aa z	5	l æɪ s ɐː z
LACERS	l ae k ax z	5	l æ k ə z
LACERS	l ey s ax z	5	l æɪ s ə z
LACES	l ey s ih z	5	l æɪ s ɪ z
LACHER	l ae k hh er	5	l æ k h ɜː
LACHES	l ey ch ih z	5	l æɪ tʃ ɪ z
LACIER	l ey s ia r	5	l æɪ s ɪə ɹ
LACING	l ey s ih ng	5	l æɪ s ɪ ŋ
LACKER	l ae k ax r	5	l æ k ə ɹ
LACKERS	l ae k ax z	5	l æ k ə z
LACKEY'S	l ae k iy z	5	l æ k iː z
LACKEYED	l ae k iy d	5	l æ k iː d
LACKEYS	l ae k ih z	5	l æ k ɪ z
LACKING	l ae k ih ng	5	l æ k ɪ ŋ
LACKNEY	l ae k n iy	5	l æ k n iː
LACLAIR	l ae k l ea	5	l æ k l eː
LACOMB	l ax k ow m	5	l ə k əʉ m
LACOUR	l ae k aw ax	5	l æ k æɔ ə
LACQUER	l ae k ax r	5	l æ k ə ɹ
LACQUER'S	l ae k ax z	5	l æ k ə z
LACQUERED	l ae k ax d	5	l æ k ə d
LACQUERS	l ae k ax z	5	l æ k ə z
LACTER	l ae k t er	5	l æ k t ɜː
LACY'S	l ey s iy z	5	l æɪ s iː z
LADA'S	l ae d ey z	5	l æ d æɪ z
LADDER	l ae d ax r	5	l æ d ə ɹ
LADDER'S	l ae d ax z	5	l æ d ə z
LADDERED	l ae d ax d	5	l æ d ə d
LADDERS	l ae d ax z	5	l æ d ə z
LADDIE'S	l ae d iy z	5	l æ d iː z
LADDIES	l ae d ih z	5	l æ d ɪ z
LADED	l ae d ih d	5	l æ d ɪ d
LADED	l ey d ih d	5	l æɪ d ɪ d
LADENED	l ey d n d	5	l æɪ d n d
LADENS	l ey d n z	5	l æɪ d n z
LADER	l ae d ax r	5	l æ d ə ɹ
LADER	l ey d ax r	5	l æɪ d ə ɹ
LADER'S	l ey d aa z	5	l æɪ d ɐː z
LADERS	l ae d ax z	5	l æ d ə z
LADERS	l ey d ax z	5	l æɪ d ə z
LADIES	l ey d ih z	5	l æɪ d ɪ z
LADING	l ey d ih ng	5	l æɪ d ɪ ŋ
LADLE'S	l ey d l z	5	l æɪ d l z
LADLED	l ey d l d	5	l æɪ d l d
LADLER	l ey d l ax	5	l æɪ d l ə
LADLES	l ey d l z	5	l æɪ d l z
LADLEY	l ae d l ey	5	l æ d l æɪ
LADY'S	l ey d iy z	5	l æɪ d iː z
LADYES	l ey d iy z	5	l æɪ d iː z
LAENDER	l eh n d ax	5	l e n d ə
LAGACE	l ae g ey s	5	l æ g æɪ s
LAGE'S	l ae g iy z	5	l æ g iː z
LAGER	l aa g ax r	5	l ɐː g ə ɹ
LAGER'S	l aa g ax z	5	l ɐː g ə z
LAGERED	l aa g ax d	5	l ɐː g ə d
LAGERS	l aa g ax z	5	l ɐː g ə z
LAGGARD	l ae g ax d	5	l æ g ə d
LAGGERS	l ae g ax z	5	l æ g ə z
LAGGING	l ae g ih ng	5	l æ g ɪ ŋ
LAGLER	l ae g l ax	5	l æ g l ə
LAGO'S	l ae g ow z	5	l æ g əʉ z
LAGOON	l ax g uw n	5	l ə g ʉː n
LAGOS	l ey g oh s	5	l æɪ g ɔ s
LAGROW	l ae g r aw	5	l æ g ɹ æɔ
LAHMAN	l aa m ae n	5	l ɐː m æ n
LAHMANN	l aa m ae n	5	l ɐː m æ n
LAHORE	l ax hh ao r	5	l ə h oː ɹ
LAHORE'S	l ax hh ao z	5	l ə h oː z
LAIDED	l ey d ih d	5	l æɪ d ɪ d
LAIDLAW	l ey d l ao	5	l æɪ d l oː
LAIDLEY	l ey d l ey	5	l æɪ d l æɪ
LAINE'S	l ey n iy z	5	l æɪ n iː z
LAINER	l ey n ax r	5	l æɪ n ə ɹ
LAINGS	l aa ih ng z	5	l ɐː ɪ ŋ z
LAINGS	l ae ih ng z	5	l æ ɪ ŋ z
LAINGS	l ao ih ng z	5	l oː ɪ ŋ z
LAINGS	l ax ih ng z	5	l ə ɪ ŋ z
LAINO'S	l ey n ow z	5	l æɪ n əʉ z
LAINTS	l ey n t s	5	l æɪ n t s
LAIRING	l ea r ih ng	5	l eː ɹ ɪ ŋ
LAIRMAN	l ea m ae n	5	l eː m æ n
LAIRMORE	l ea m ao r	5	l eː m oː ɹ
LAIRSON	l ea s ah n	5	l eː s ɐ n
LAITY	l ey ax t iy	5	l æɪ ə t iː
LAKER	l ey k ax r	5	l æɪ k ə ɹ
LAKER'S	l ey k aa z	5	l æɪ k ɐː z
LAKERS	l ey k ax z	5	l æɪ k ə z
LAKESHORE	l ey k sh ao	5	l æɪ k ʃ oː
LAKEWAY	l ey k w ey	5	l æɪ k w æɪ
LAKING	l ey k ih ng	5	l æɪ k ɪ ŋ
LAMA'S	l aa m ax z	5	l ɐː m ə z
LAMAR	l aa m ax ax	5	l ɐː m ə ə
LAMARE	l ae m aa r	5	l æ m ɐː ɹ
LAMARK	l ae m aa k	5	l æ m ɐː k
LAMAS	l aa m ax z	5	l ɐː m ə z
LAMBDA	l ae m d ax	5	l æ m d ə
LAMBE	l ae m b iy	5	l æ m b iː
LAMBE'S	l ae m iy z	5	l æ m iː z
LAMBEAU	l ae m b ow	5	l æ m b əʉ
LAMBER	l ae m ax r	5	l æ m ə ɹ
LAMBERS	l ae m ax z	5	l æ m ə z
LAMBIA	l ae m b ia	5	l æ m b ɪə
LAMBIE	l ae m b iy	5	l æ m b iː
LAMBING	l ae m ih ng	5	l æ m ɪ ŋ
LAMBOO	l ae m b uw	5	l æ m b ʉː
LAMBOUR	l ae m aw ax	5	l æ m æɔ ə
LAMBOY	l ae m b oy	5	l æ m b oɪ
LAMEDS	l ey m d z	5	l æɪ m d z
LAMELL	l ae m eh l	5	l æ m e l
LAMELY	l ey m l iy	5	l æɪ m l iː
LAMER	l ey m ax r	5	l æɪ m ə ɹ
LAMER'S	l ey m ax z	5	l æɪ m ə z
LAMERS	l ey m ax z	5	l æɪ m ə z
LAMING	l ey m ih ng	5	l æɪ m ɪ ŋ
LAMLEY	l ae m l ey	5	l æ m l æɪ
LAMMAR	l ae m ax r	5	l æ m ə ɹ
LAMMAS	l ae m ax s	5	l æ m ə s
LAMMER	l ae m ax r	5	l æ m ə ɹ
LAMMERS	l ae m ax z	5	l æ m ə z
LAMMING	l ae m ih ng	5	l æ m ɪ ŋ
LAMMOCK	l ae m ax k	5	l æ m ə k
LAMMON	l ae m ax n	5	l æ m ə n
LAMMOTH	l ae m ax th	5	l æ m ə θ
LAMOUR	l ae m aw ax	5	l æ m æɔ ə
LAMP'S	l ae m p s	5	l æ m p s
LAMPED	l ae m p t	5	l æ m p t
LAMPER	l ae m p ax	5	l æ m p ə
LAMPES	l ae m p s	5	l æ m p s
LAMPI	l ae m p iy	5	l æ m p iː
LAMPIE	l ae m p ay	5	l æ m p ɑe
LAMPLE	l ae m p l	5	l æ m p l
LAMPO	l ae m p ow	5	l æ m p əʉ
LAMPOO	l ae m p uw	5	l æ m p ʉː
LAMPS	l ae m p s	5	l æ m p s
LANARK	l ae n ax k	5	l æ n ə k
LANCED	l aa n s t	5	l ɐː n s t
LANCER	l aa n s ax	5	l ɐː n s ə
LANCHOW	l ae n ch aw	5	l æ n tʃ æɔ
LAND'S	l ae n d z	5	l æ n d z
LANDA	l ae n d ax	5	l æ n d ə
LANDAL	l ae n d l	5	l æ n d l
LANDAU	l ae n d ao	5	l æ n d oː
LANDAY	l ae n d ey	5	l æ n d æɪ
LANDEL	l ae n d l	5	l æ n d l
LANDER	l ae n d ax	5	l æ n d ə
LANDES	l ae n d z	5	l æ n d z
LANDI	l ae n d iy	5	l æ n d iː
LANDIA	l ae n d ia	5	l æ n d ɪə
LANDIE	l ae n d iy	5	l æ n d iː
LANDIER	l ae n d ia	5	l æ n d ɪə
LANDLE	l ae n d l	5	l æ n d l
LANDO	l ae n d ow	5	l æ n d əʉ
LANDOW	l ae n d aw	5	l æ n d æɔ
LANDS	l ae n d z	5	l æ n d z
LANDY	l ae n d iy	5	l æ n d iː
LANER'S	l ey n aa z	5	l æɪ n ɐː z
LANGA'S	l ae ng ey z	5	l æ ŋ æɪ z
LANGE'S	l ae ng iy z	5	l æ ŋ iː z
LANGEN	l ae ng ax n	5	l æ ŋ ə n
LANGER	l ae ng ax r	5	l æ ŋ ə ɹ
LANGER'S	l ae ng ax z	5	l æ ŋ ə z
LANGERS	l ae ng ax z	5	l æ ŋ ə z
LANGILL	l ae ng ih l	5	l æ ŋ ɪ l
LANGLEY	l ae ng l ey	5	l æ ŋ l æɪ
LANGLOW	l ae ng l ow	5	l æ ŋ l əʉ
LANGOUR	l ae ng aw ax	5	l æ ŋ æɔ ə
LANGST	l ae ng s t	5	l æ ŋ s t
LANGUOR	l ae ng g ax	5	l æ ŋ g ə
LANGUR	l ah ng g ua	5	l ɐ ŋ g ʊə
LANI'S	l ae n ay z	5	l æ n ɑe z
LANICE	l ae n ay s	5	l æ n ɑe s
LANKA	l ae n k ax	5	l æ n k ə
LANKED	l ae ng k t	5	l æ ŋ k t
LANKER	l ae ng k ax	5	l æ ŋ k ə
LANKES	l ae ng k s	5	l æ ŋ k s
LANKIER	l ae ng k ia	5	l æ ŋ k ɪə
LANKY	l ae ng k iy	5	l æ ŋ k iː
LANNAN	l ae n ax n	5	l æ n ə n
LANNAR	l ae n ax ax	5	l æ n ə ə
LANNERS	l ae n ax z	5	l æ n ə z
LANNIN	l ae n ih n	5	l æ n ɪ n
LANNING	l ae n ih ng	5	l æ n ɪ ŋ
LANNOCK	l ae n ax k	5	l æ n ə k
LANTEAU	l ae n t ow	5	l æ n t əʉ
LANTEL	l ae n t l	5	l æ n t l
LANTER	l ae n t ax	5	l æ n t ə
LANTIE	l ae n t ay	5	l æ n t ɑe
LANTIER	l ae n t ia	5	l æ n t ɪə
LANTOW	l ae n t ow	5	l æ n t əʉ
LAOTIAN	l aa oh sh n	5	l ɐː ɔ ʃ n
LAPAGE	l ae p ey jh	5	l æ p æɪ dʒ
LAPEL	l ax p eh l	5	l ə p e l
LAPIN	l ae p ih n	5	l æ p ɪ n
LAPIS	l ae p ih s	5	l æ p ɪ s
LAPPERS	l ae p ax z	5	l æ p ə z
LAPPET	l ae p ih t	5	l æ p ɪ t
LAPPING	l ae p ih ng	5	l æ p ɪ ŋ
LAPPISH	l ae p ih sh	5	l æ p ɪ ʃ
LAPRE	l ae p r iy	5	l æ p ɹ iː
LAPSED	l ae p s t	5	l æ p s t
LAPSER	l ae p s ax	5	l æ p s ə
LAPTES	l ae p t s	5	l æ p t s
LARAWAY	l aa ax w ey	5	l ɐː ə w æɪ
LARBOARD	l aa b ax d	5	l ɐː b ə d
LARCH'S	l aa ch ih z	5	l ɐː tʃ ɪ z
LARCHE'S	l aa ch iy z	5	l ɐː tʃ iː z
LARCHER	l aa ch ax r	5	l ɐː tʃ ə ɹ
LARCHER'S	l aa ch ax z	5	l ɐː tʃ ə z
LARCHES	l aa ch ih z	5	l ɐː tʃ ɪ z
LARCOS	l aa k oh s	5	l ɐː k ɔ s
LARDED	l aa d ih d	5	l ɐː d ɪ d
LARDER	l aa d ax r	5	l ɐː d ə ɹ
LARDER'S	l aa d ax z	5	l ɐː d ə z
LARDERS	l aa d ax z	5	l ɐː d ə z
LARDIE	l aa d ay iy	5	l ɐː d ɑe iː
LARDIN	l aa d ih n	5	l ɐː d ɪ n
LARDING	l aa d ih ng	5	l ɐː d ɪ ŋ
LARDON	l aa d oh n	5	l ɐː d ɔ n
LARES	l ea r iy z	5	l eː ɹ iː z
LARESE	l ea r iy z	5	l eː ɹ iː z
LAREST	l aa ih s t	5	l ɐː ɪ s t
LARGE'S	l aa jh ih z	5	l ɐː dʒ ɪ z
LARGEISH	l aa jh ih sh	5	l ɐː dʒ ɪ ʃ
LARGELY	l aa jh l iy	5	l ɐː dʒ l iː
LARGEN	l aa jh eh n	5	l ɐː dʒ e n
LARGER	l aa jh ax r	5	l ɐː dʒ ə ɹ
LARGES	l aa jh ih z	5	l ɐː dʒ ɪ z
LARGESS	l aa jh eh s	5	l ɐː dʒ e s
LARGESSE	l aa jh eh s	5	l ɐː dʒ e s
LARGET	l aa g eh t	5	l ɐː g e t
LARGISH	l aa jh ih sh	5	l ɐː dʒ ɪ ʃ
LARGO'S	l aa g ow z	5	l ɐː g əʉ z
LARGOS	l aa g ow z	5	l ɐː g əʉ z
LARIAN	l aa iy ax n	5	l ɐː iː ə n
LARIAT	l ae r ia t	5	l æ ɹ ɪə t
LARION	l aa ay ax n	5	l ɐː ɑe ə n
LARIOT	l ae r ia t	5	l æ ɹ ɪə t
LARKER	l aa k ax r	5	l ɐː k ə ɹ
LARKERS	l aa k ax z	5	l ɐː k ə z
LARKIN	l aa k ih n	5	l ɐː k ɪ n
LARKING	l aa k ih ng	5	l ɐː k ɪ ŋ
LARMAN	l aa m ae n	5	l ɐː m æ n
LARMAR	l aa m aa ch	5	l ɐː m ɐː tʃ
LARMER'S	l aa m ax z	5	l ɐː m ə z
LARMING	l aa m ih ng	5	l ɐː m ɪ ŋ
LARMORE	l aa m ao r	5	l ɐː m oː ɹ
LARNARD	l aa n aa d	5	l ɐː n ɐː d
LARNELL	l aa n eh l	5	l ɐː n e l
LARNELLE	l aa n eh l	5	l ɐː n e l
LARNER	l aa n ax r	5	l ɐː n ə ɹ
LARNER'S	l aa n aa z	5	l ɐː n ɐː z
LARNERD	l aa n ax d	5	l ɐː n ə d
LARNING	l aa n ih ng	5	l ɐː n ɪ ŋ
LARRAN	l aa r ae n	5	l ɐː ɹ æ n
LARRICK	l ae r ih k	5	l æ ɹ ɪ k
LARRIER	l ae r iy ax	5	l æ ɹ iː ə
LARRIS	l ae r ih s	5	l æ ɹ ɪ s
LARRY'S	l ae r iy z	5	l æ ɹ iː z
LARRYS	l ae r iy z	5	l æ ɹ iː z
LARSEN	l aa s eh n	5	l ɐː s e n
LARSON	l aa s ah n	5	l ɐː s ɐ n
LARUM	l ae r ax m	5	l æ ɹ ə m
LARVA'S	l aa v ax z	5	l ɐː v ə z
LARVAS	l aa v ax z	5	l ɐː v ə z
LARVIS	l aa v ih s	5	l ɐː v ɪ s
LARY'S	l aa w ay z	5	l ɐː w ɑe z
LASCA	l ae s k ax	5	l æ s k ə
LASCAR	l ae s k ax	5	l æ s k ə
LASCO	l ae s k ow	5	l æ s k əʉ
LASE'S	l ae s iy z	5	l æ s iː z
LASER	l ey z ax r	5	l æɪ z ə ɹ
LASER'S	l ey z ax z	5	l æɪ z ə z
LASERED	l ey z ax d	5	l æɪ z ə d
LASERS	l ey z ax z	5	l æɪ z ə z
LASES	l ae s ih z	5	l æ s ɪ z
LASH-UP	l ae sh ah p	5	l æ ʃ ɐ p
LASHER'S	l ae sh ax z	5	l æ ʃ ə z
LASHERS	l ae sh ax z	5	l æ ʃ ə z
LASHES	l ae sh ih z	5	l æ ʃ ɪ z
LASHING	l ae sh ih ng	5	l æ ʃ ɪ ŋ
LASHLEE	l ae sh l iy	5	l æ ʃ l iː
LASHLEY	l ae sh l ey	5	l æ ʃ l æɪ
LASHLY	l ae sh l iy	5	l æ ʃ l iː
LASHWAY	l ae sh w ey	5	l æ ʃ w æɪ
LASING	l ae s ih ng	5	l æ s ɪ ŋ
LASKA	l ae s k ax	5	l æ s k ə
LASKEY	l ae s k iy	5	l æ s k iː
LASLEY	l ae s l ey	5	l æ s l æɪ
LASLOW	l ae s l ow	5	l æ s l əʉ
LASS'S	l ae s ih z	5	l æ s ɪ z
LASSER	l ae s ax r	5	l æ s ə ɹ
LASSER'S	l ae s ax z	5	l æ s ə z
LASSERS	l ae s ax z	5	l æ s ə z
LASSES	l ae s ih z	5	l æ s ɪ z
LASSIC	l ae s ih k	5	l æ s ɪ k
LASSIE'S	l ae s iy z	5	l æ s iː z
LASSIES	l ae s ih z	5	l æ s ɪ z
LASSO'S	l ae s uw z	5	l æ s ʉː z
LASSOED	l ae s uw d	5	l æ s ʉː d
LASSOER	l ae s uw ax	5	l æ s ʉː ə
LASSOES	l ae s uw z	5	l æ s ʉː z
LASSOS	l ae s uw z	5	l æ s ʉː z
LAST'S	l aa s t s	5	l ɐː s t s
LAST'S	l ae s t s	5	l æ s t s
LASTER	l aa s t ax	5	l ɐː s t ə
LASTER	l ae s t ax	5	l æ s t ə
LASTES	l aa s t s	5	l ɐː s t s
LASTES	l ae s t s	5	l æ s t s
LASTS	l aa s t s	5	l ɐː s t s
LATA'S	l ae t ey z	5	l æ t æɪ z
LATCHAW	l ae t ch ao	5	l æ t tʃ oː
LATCHES	l ae ch ih z	5	l æ tʃ ɪ z
LATCHES'	l ae ch ih z	5	l æ tʃ ɪ z
LATCHET	l ae ch ih t	5	l æ tʃ ɪ t
LATCHING	l ae ch ih ng	5	l æ tʃ ɪ ŋ
LATCHKEY	l ae ch k iy	5	l æ tʃ k iː
LATCHS	l ae ch ih z	5	l æ tʃ ɪ z
LATED	l ae t ih d	5	l æ t ɪ d
LATED	l ey t ih d	5	l æɪ t ɪ d
LATEEN	l ax t iy n	5	l ə t iː n
LATELL	l ae t eh l	5	l æ t e l
LATELY	l ey t l iy	5	l æɪ t l iː
LATEN	l ey t ax n	5	l æɪ t ə n
LATENT	l ey t n t	5	l æɪ t n t
LATER	l ey t ax r	5	l æɪ t ə ɹ
LATER'S	l ey t ax z	5	l æɪ t ə z
LATERS	l ey t ax z	5	l æɪ t ə z
LATHER	l aa dh ax r	5	l ɐː ð ə ɹ
LATHERED	l aa dh ax d	5	l ɐː ð ə d
LATHERER	l aa dh ax ax	5	l ɐː ð ə ə
LATHERS	l aa dh ax z	5	l ɐː ð ə z
LATHIER	l aa t iy ax	5	l ɐː t iː ə
LATHING	l aa th ih ng	5	l ɐː θ ɪ ŋ
LATHIS	l aa t ih z	5	l ɐː t ɪ z
LATIN	l ae t ih n	5	l æ t ɪ n
LATIONS	l ey sh n z	5	l æɪ ʃ n z
LATISH	l ey t ih sh	5	l æɪ t ɪ ʃ
LATOUR	l ae t aw ax	5	l æ t æɔ ə
LATSHAW	l ae t sh ao	5	l æ t ʃ oː
LATTA'S	l ae t ax z	5	l æ t ə z
LATTAS	l ae t ax z	5	l æ t ə z
LATTER	l ae t ax r	5	l æ t ə ɹ
LATTER'S	l ae t ax z	5	l æ t ə z
LATTERS	l ae t ax z	5	l æ t ə z
LATTICE	l ae t ih s	5	l æ t ɪ s
LATTING	l ae t ih ng	5	l æ t ɪ ŋ
LATTIS	l ae t ih s	5	l æ t ɪ s
LAUDAN	l ao d ax n	5	l oː d ə n
LAUDED	l ao d ih d	5	l oː d ɪ d
LAUDER	l ao d ax r	5	l oː d ə ɹ
LAUDER'S	l ao d ax z	5	l oː d ə z
LAUDERS	l ao d ax z	5	l oː d ə z
LAUDING	l ao d ih ng	5	l oː d ɪ ŋ
LAUDIO	l ao d iy ow	5	l oː d iː əʉ
LAUGHER'S	l aa f ax z	5	l ɐː f ə z
LAUGHERS	l aa f ax z	5	l ɐː f ə z
LAUGHING	l aa f ih ng	5	l ɐː f ɪ ŋ
LAUGHTER	l aa f t ax	5	l ɐː f t ə
LAUNCHD	l ao n ch t	5	l oː n tʃ t
LAUNCHED	l ao n ch t	5	l oː n tʃ t
LAUNCHER	l ao n ch ax	5	l oː n tʃ ə
LAUNDA	l ao n d ax	5	l oː n d ə
LAUNDER	l ao n d ax	5	l oː n d ə
LAUNDY	l ao n d iy	5	l oː n d iː
LAURA'S	l ao r ax z	5	l oː ɹ ə z
LAURAL	l ao r ax l	5	l oː ɹ ə l
LAURAS	l ao r ax z	5	l oː ɹ ə z
LAUREATE	l oh r ia t	5	l ɔ ɹ ɪə t
LAUREL	l oh r ax l	5	l ɔ ɹ ə l
LAUREN	l oh r ax n	5	l ɔ ɹ ə n
LAURUS	l oh r ax s	5	l ɔ ɹ ə s
LAUSANNE	l ow z ae n	5	l əʉ z æ n
LAVA'S	l aa v ax z	5	l ɐː v ə z
LAVAGE	l ae v ey jh	5	l æ v æɪ dʒ
LAVALE	l ae v ey l	5	l æ v æɪ l
LAVALL	l ae v ao l	5	l æ v oː l
LAVAS	l aa v ax z	5	l ɐː v ə z
LAVELL	l ae v eh l	5	l æ v e l
LAVERNE	l ae v er n	5	l æ v ɜː n
LAVERS	l ey v ax z	5	l æɪ v ə z
LAVERSE	l ae v er s	5	l æ v ɜː s
LAVI'S	l ae v ay z	5	l æ v ɑe z
LAVIES	l ey v ih z	5	l æɪ v ɪ z
LAVIN	l ey v ih n	5	l æɪ v ɪ n
LAVINE	l ey v ih n	5	l æɪ v ɪ n
LAVING	l ey v ih ng	5	l æɪ v ɪ ŋ
LAVISH	l ae v ih sh	5	l æ v ɪ ʃ
LAWARE'S	l ao aa r z	5	l oː ɐː ɹ z
LAWBOOK	l ao b uh k	5	l oː b ʊ k
LAWCOURT	l ao k ao t	5	l oː k oː t
LAWFORD	l ao f ao d	5	l oː f oː d
LAWFUL	l ao f ax l	5	l oː f ə l
LAWFULL	l ao f uh l	5	l oː f ʊ l
LAWGIVE	l ao g ih v	5	l oː g ɪ v
LAWHEAD	l ao hh eh d	5	l oː h e d
LAWHON	l ao hh oh n	5	l oː h ɔ n
LAWHORN	l ao hh ao n	5	l oː h oː n
LAWINGS	l ao ih ng z	5	l oː ɪ ŋ z
LAWLERS	l ao l ax z	5	l oː l ə z
LAWLESS	l ao l ax s	5	l oː l ə s
LAWLEY'S	l ao l ey z	5	l oː l æɪ z
LAWLEYS	l ao l ey z	5	l oː l æɪ z
LAWLOR'S	l ao l ao z	5	l oː l oː z
LAWMAKE	l ao m ey k	5	l oː m æɪ k
LAWMAN	l ao m ae n	5	l oː m æ n
LAWMEN	l ao m eh n	5	l oː m e n
LAWNER	l ao n ax r	5	l oː n ə ɹ
LAWNER'S	l ao n ax z	5	l oː n ə z
LAWRY'S	l ao r iy z	5	l oː ɹ iː z
LAWRYS	l ao r iy z	5	l oː ɹ iː z
LAWS'S	l ao z ih z	5	l oː z ɪ z
LAWSON	l ao s ah n	5	l oː s ɐ n
LAWSUIT	l ao s uw t	5	l oː s ʉː t
LAWTON	l ao t ah n	5	l oː t ɐ n
LAWYER	l ao y ax r	5	l oː j ə ɹ
LAWYER'S	l ao y ax z	5	l oː j ə z
LAWYERED	l ao y ax d	5	l oː j ə d
LAWYERS	l ao y ax z	5	l oː j ə z
LAXER	l ae k s ax	5	l æ k s ə
LAY-OFFS	l ey oh f s	5	l æɪ ɔ f s
LAY-OUTS	l ey aw t s	5	l æɪ æɔ t s
LAYAWAY	l ey ax w ey	5	l æɪ ə w æɪ
LAYBACK	l ey b ae k	5	l æɪ b æ k
LAYBORNE	l ey b ao n	5	l æɪ b oː n
LAYBOURNE	l ey b ao n	5	l æɪ b oː n
LAYBURN	l ey b er n	5	l æɪ b ɜː n
LAYBYS	l ey b ay z	5	l æɪ b ɑe z
LAYCOCK	l ey k oh k	5	l æɪ k ɔ k
LAYDEN	l ey d eh n	5	l æɪ d e n
LAYDON	l ey d oh n	5	l æɪ d ɔ n
LAYER'S	l ey ax r z	5	l æɪ ə ɹ z
LAYETTES	l ey eh t s	5	l æɪ e t s
LAYINGS	l ey ih ng z	5	l æɪ ɪ ŋ z
LAYMAN	l ey m ax n	5	l æɪ m ə n
LAYMEN	l ey m ax n	5	l æɪ m ə n
LAYMORE	l ey m ao r	5	l æɪ m oː ɹ
LAYOFF'S	l ey ao f s	5	l æɪ oː f s
LAYOFFS	l ey ao f s	5	l æɪ oː f s
LAYOUT'S	l ey aw t s	5	l æɪ æɔ t s
LAYOUTS	l ey aw t s	5	l æɪ æɔ t s
LAYOVER	l ey ow v ax	5	l æɪ əʉ v ə
LAYSON	l ey s ah n	5	l æɪ s ɐ n
LAYTON	l ey t ah n	5	l æɪ t ɐ n
LAYUPS	l ey ah p s	5	l æɪ ɐ p s
LAZAR	l ae z ax r	5	l æ z ə ɹ
LAZAR'S	l ae z ax z	5	l æ z ə z
LAZARD	l ae z ax d	5	l æ z ə d
LAZARES	l ae z ax z	5	l æ z ə z
LAZARS	l ae z ax z	5	l æ z ə z
LAZER	l ey z ax r	5	l æɪ z ə ɹ
LAZER'S	l ey z aa z	5	l æɪ z ɐː z
LAZERS	l ey z ax z	5	l æɪ z ə z
LAZES	l ey z ih z	5	l æɪ z ɪ z
LAZIER	l ey z ia r	5	l æɪ z ɪə ɹ
LAZING	l ey z ih ng	5	l æɪ z ɪ ŋ
LA_PAZ	l ae p ae z	5	l æ p æ z
LEACH'S	l iy ch ih z	5	l iː tʃ ɪ z
LEACHER	l iy ch ax r	5	l iː tʃ ə ɹ
LEACHERS	l iy ch ax z	5	l iː tʃ ə z
LEACHES	l iy ch ih z	5	l iː tʃ ɪ z
LEACHING	l iy ch ih ng	5	l iː tʃ ɪ ŋ
LEACOCK	l iy k oh k	5	l iː k ɔ k
LEAD-IN	l iy d ih n	5	l iː d ɪ n
LEAD-ORE	l eh d ao r	5	l e d oː ɹ
LEADED	l eh d ih d	5	l e d ɪ d
LEADER	l iy d ax r	5	l iː d ə ɹ
LEADER'S	l iy d ax z	5	l iː d ə z
LEADERS	l iy d ax z	5	l iː d ə z
LEADIN	l iy d ih n	5	l iː d ɪ n
LEADING	l eh d ih ng	5	l e d ɪ ŋ
LEADING	l iy d ih ng	5	l iː d ɪ ŋ
LEADOFF	l iy d oh f	5	l iː d ɔ f
LEADWAY	l eh d w ey	5	l e d w æɪ
LEAFAGE	l iy f ey jh	5	l iː f æɪ dʒ
LEAFIER	l iy f ia r	5	l iː f ɪə ɹ
LEAFING	l iy f ih ng	5	l iː f ɪ ŋ
LEAFORD	l iy f ao d	5	l iː f oː d
LEAFY'S	l iy f iy z	5	l iː f iː z
LEAGUER'S	l iy g ax z	5	l iː g ə z
LEAGUERED	l iy g ax d	5	l iː g ə d
LEAGUERS	l iy g ax z	5	l iː g ə z
LEAGUING	l iy g ih ng	5	l iː g ɪ ŋ
LEAHEY'S	l iy hh ey z	5	l iː h æɪ z
